rank,Category,Indicator,Policy,Country,ISO,value,unit,year
1,Demographics,Individuals using the Internet,H3_Contact tracing,Nigeria,NGA,42.0,percent of population,2019.0
2,Demographics,Fixed telephone subscriptions,H3_Contact tracing,Nigeria,NGA,140491.0,number,2019.0
3,Health,Prevalence of Respiratory infections and tuberculosis,H3_Contact tracing,Nigeria,NGA,0.238966,percent,2019.0
4,Health,Prevalence of COVID-19,H3_Contact tracing,Nigeria,NGA,77013.0,"Number (cumulative total by Dec 26,2020)",2020.0
5,Governance,Economic Freedom Score,H3_Contact tracing,Nigeria,NGA,6.93,score,2018.0
6,Social issues ,Press freedom score,H3_Contact tracing,Nigeria,NGA,35.63,score,2020.0
7,Health,Mortality due to COVID-19,H3_Contact tracing,Nigeria,NGA,1212.0,"Number (cumulative total by Dec 26,2020)",2020.0
8,Health,"Prevalence of overweight (modeled estimate, % of children under 5)",H3_Contact tracing,Nigeria,NGA,2.7,percent,2020.0
9,Governance,Rule of law estimate ,H3_Contact tracing,Nigeria,NGA,-0.8979821,score,2019.0
10,Health,Prevalence of down syndrome,H3_Contact tracing,Nigeria,NGA,0.000134,percent,2019.0
11,Environment,Fossil fuel energy consumption,H3_Contact tracing,Nigeria,NGA,18.87677,percent of total,2014.0
12,Governance,Regulatory quality estimate,H3_Contact tracing,Nigeria,NGA,-0.8609852,score,2019.0
13,Health,Prevalence of Diabetes,H3_Contact tracing,Nigeria,NGA,0.014004,percent,2019.0
15,Demographics,Fixed broadband subscriptions,H3_Contact tracing,Nigeria,NGA,0.0377614,per 100 people,2019.0
16,Social issues ,Proportion of seats held by women in national parliaments (%),H3_Contact tracing,Nigeria,NGA,3.631284916,proportion,2020.0
17,Environment,Combustible renewables and waste,H3_Contact tracing,Nigeria,NGA,74.33917,percent of total energy,2014.0
18,Health,Prevalence of total cancers,H3_Contact tracing,Nigeria,NGA,0.001973,percent,2019.0
20,Economics,Employment in services (% of total employment) (modeled ILO estimate),H3_Contact tracing,Nigeria,NGA,53.1030006,Percentage of total employment,2020.0
21,Social issues ,Gini index (World Bank estimate),H3_Contact tracing,Nigeria,NGA,35.1,index ,2018.0
22,Environment,Electricity production from coal sources ,H3_Contact tracing,Nigeria,NGA,0.0,percent of total,2015.0
23,Environment,"PM2.5 air pollution, mean annual exposure",H3_Contact tracing,Nigeria,NGA,71.79817,micrograms per cubic meter,2017.0
24,Health,Prevalence of anxiety disorders,H3_Contact tracing,Nigeria,NGA,0.027786,percent,2019.0
25,Environment,Renewable energy consumption ,H3_Contact tracing,Nigeria,NGA,86.6356215634187,percent of total final energy consumption,2015.0
26,Governance,Corruption Perceptions Index,H3_Contact tracing,Nigeria,NGA,25.0,score,2020.0
27,Social issues ,Life Ladder ,H3_Contact tracing,Nigeria,NGA,4.759300231933594,score,2021.0
28,Social issues ,Net migration,H3_Contact tracing,Nigeria,NGA,-300000.0,net total / data are 5 year estimates,2019.0
29,Environment,"Electricity production from renewable sources, excluding hydroelectric",H3_Contact tracing,Nigeria,NGA,0.0,kWh,2015.0
30,Governance,Total freedom in the world score ,H3_Contact tracing,Nigeria,NGA,45.0,score,2021.0
31,Demographics,Secure Internet servers ,H3_Contact tracing,Nigeria,NGA,74.81951992708888,per 1 million people,2019.0
32,Governance,Fragile States Index Total ,H3_Contact tracing,Nigeria,NGA,97.2675111298435,score,2020.0
33,Health,"Nurses and midwives (per 1,000 people)",H3_Contact tracing,Nigeria,NGA,1.1792,Ones,2018.0
34,Health,"Incidence of tuberculosis (per 100,000 people)",H3_Contact tracing,Nigeria,NGA,219.0,Cases,2019.0
35,Governance,Human Development Index,H3_Contact tracing,Nigeria,NGA,0.539,index,2019.0
36,Health,"Prevalence of stunting, height for age (modeled estimate, % of children under 5)",H3_Contact tracing,Nigeria,NGA,35.3,percent,2020.0
37,Economics,"Labor force participation rate, female (% of female population ages 15+) (modeled ILO estimate)",H3_Contact tracing,Nigeria,NGA,47.5610008,Percentage of females of the total population,2020.0
40,Health,Prevalence of obesity,H3_Contact tracing,Nigeria,NGA,8.9,percent,2016.0
41,Environment,CO2 emissions (kt),H3_Contact tracing,Nigeria,NGA,120369.3,kt,2016.0
42,Governance,Aggregate score for the Civil Liberties category,H3_Contact tracing,Nigeria,NGA,24.0,score,2021.0
44,Environment,"Adjusted net savings, including particulate emission damage",H3_Contact tracing,Nigeria,NGA,0.0508124413238705,percent of GNI,2018.0
45,Environment,"Electricity production from oil, gas and coal sources",H3_Contact tracing,Nigeria,NGA,81.80487494431362,percent of total,2015.0
49,Health,"Physicians (per 1,000 people)",H3_Contact tracing,Nigeria,NGA,0.3806,Ones,2018.0
50,Demographics,Mobile cellular subscriptions,H3_Contact tracing,Nigeria,NGA,88.1842,per 100 people,2019.0
51,Health,Prevalence of Hypertensive heart disease,H3_Contact tracing,Nigeria,NGA,0.00099,percent,2019.0
52,Governance,Human Freedom Score ,H3_Contact tracing,Nigeria,NGA,6.05,score,2018.0
53,Health,Prevalence of chronic kidney disease,H3_Contact tracing,Nigeria,NGA,0.038962,percent,2019.0
54,Governance,Voice and accountability estimate,H3_Contact tracing,Nigeria,NGA,-0.412996,score,2019.0
55,Governance,Aggregate score for the Political Rights category,H3_Contact tracing,Nigeria,NGA,21.0,score,2021.0
56,Environment,Electric power consumption ,H3_Contact tracing,Nigeria,NGA,144.5254622232664,kWh per capita,2014.0
57,Health,Prevalence of Depressive disorders,H3_Contact tracing,Nigeria,NGA,0.027553,percent,2019.0
58,Health,Summary exposure value tobacco,H3_Contact tracing,Nigeria,NGA,9.018408,Rate (risk-weighted prevalence),2019.0
61,Environment,Electricity production from nuclear sources ,H3_Contact tracing,Nigeria,NGA,0.0,percent of total,2014.0
62,Environment,"PM2.5 air pollution, population exposed to levels exceeding WHO guideline value ",H3_Contact tracing,Nigeria,NGA,100.0,percent of total,2017.0
63,Environment,Electricity production from oil sources,H3_Contact tracing,Nigeria,NGA,0.0,percent of total,2015.0
64,Environment,Energy use ,H3_Contact tracing,Nigeria,NGA,138.4297449087446,"(kg of oil equivalent) per $1,000 GDP (constant 2017 PPP)",2014.0
65,Health,"Immunization, DPT (% of children ages 12-23 months)",H3_Contact tracing,Nigeria,NGA,57.0,percent,2019.0
66,Environment,"Energy imports, net ",H3_Contact tracing,Nigeria,NGA,-93.02721929253659,percent of energy use,2014.0
68,Governance,Personal Freedom Score ,H3_Contact tracing,Nigeria,NGA,5.16,score,2018.0
69,Governance,"CPIA transparency, accountability, and corruption in the public sector rating (1=low to 6=high)",H3_Contact tracing,Nigeria,NGA,3.0,rating,2019.0
71,Environment,Access to electricity ,H3_Contact tracing,Nigeria,NGA,56.5,percent of population,2018.0
73,Governance,Control of corruption estimate,H3_Contact tracing,Nigeria,NGA,-1.094948,score,2019.0
74,Health,"Prevalence of HIV, total (% of population ages 15-49)",H3_Contact tracing,Nigeria,NGA,1.3,percent,2019.0
75,Economics,Volume of imports,H3_Contact tracing,Nigeria,NGA,2.502,percent change,2020.0
76,Social issues ,"Intentional homicides (per 100,000 people)",H3_Contact tracing,Nigeria,NGA,34.524045903,"proportion, pero 100,000 people",2016.0
78,Health,Domestic General Government Health Expenditure (GGHE-D) as % General Government Expenditure (GGE),H3_Contact tracing,Nigeria,NGA,0.6,percent,2018.0
79,Environment,Energy use (kg of oil equivalent per capita),H3_Contact tracing,Nigeria,NGA,763.631976621602,kg of oil equivalent per capita,2014.0
80,Economics,"Unemployment, total (% of total labor force) (modeled ILO estimate)",H3_Contact tracing,Nigeria,NGA,7.96000004,percent of total labor force,2020.0
81,Governance,Political stability and absence of violence/terrorism estimate,H3_Contact tracing,Nigeria,NGA,-1.934674,score,2019.0
84,Governance,Government effectiveness estimate,H3_Contact tracing,Nigeria,NGA,-1.088634,score,2019.0
85,Economics,Volume of exports,H3_Contact tracing,Nigeria,NGA,6.162,percent change,2020.0
87,Environment,CO2 emissions (metric tons per capita),H3_Contact tracing,Nigeria,NGA,0.647285,metric tons per capita,2016.0
92,Health,"Immunization, measles (% of children ages 12-23 months)",H3_Contact tracing,Nigeria,NGA,54.0,percent,2019.0
96,Economics,"Labor force participation rate, total (% of total population ages 15+) (modeled ILO estimate)",H3_Contact tracing,Nigeria,NGA,52.6930008,Percentage of total population,2020.0
