rank,Category,Indicator,Policy,Country,ISO,value,unit,year
2,Health,Prevalence of COVID-19,E1_Income support,Anguilla,AIA,10.0,"Number (cumulative total by Dec 26,2020)",2020.0
17,Governance,Government effectiveness estimate,E1_Income support,Anguilla,AIA,0.8158239,score,2019.0
30,Governance,Rule of law estimate ,E1_Income support,Anguilla,AIA,0.3557367,score,2019.0
32,Health,Mortality due to COVID-19,E1_Income support,Anguilla,AIA,0.0,"Number (cumulative total by Dec 26,2020)",2020.0
43,Governance,Regulatory quality estimate,E1_Income support,Anguilla,AIA,0.8462311,score,2019.0
46,Governance,Political stability and absence of violence/terrorism estimate,E1_Income support,Anguilla,AIA,1.367357,score,2019.0
82,Governance,Control of corruption estimate,E1_Income support,Anguilla,AIA,1.234392,score,2019.0
