rank,Category,Indicator,Policy,Country,ISO,value,unit,year
1,Demographics,Individuals using the Internet,E1_Income support,Moldova,MDA,76.1245,percent of population,2019.0
2,Economics,Volume of exports,E1_Income support,Moldova,MDA,5.161,percent change,2020.0
3,Health,Prevalence of COVID-19,E1_Income support,Moldova,MDA,133360.0,"Number (cumulative total by Dec 26,2020)",2020.0
5,Demographics,Secure Internet servers ,E1_Income support,Moldova,MDA,4537.8657807669,per 1 million people,2019.0
6,Governance,Total freedom in the world score ,E1_Income support,Moldova,MDA,61.0,score,2021.0
7,Social issues ,"Intentional homicides (per 100,000 people)",E1_Income support,Moldova,MDA,4.0967929022,"proportion, pero 100,000 people",2018.0
8,Health,Summary exposure value tobacco,E1_Income support,Moldova,MDA,26.95885,Rate (risk-weighted prevalence),2019.0
9,Social issues ,Net migration,E1_Income support,Moldova,MDA,-6935.0,net total / data are 5 year estimates,2019.0
10,Environment,CO2 emissions (kt),E1_Income support,Moldova,MDA,5115.465,kt,2016.0
11,Governance,Economic Freedom Score,E1_Income support,Moldova,MDA,6.99,score,2018.0
12,Social issues ,Life Ladder ,E1_Income support,Moldova,MDA,5.76639986038208,score,2021.0
13,Health,Prevalence of Depressive disorders,E1_Income support,Moldova,MDA,0.04248,percent,2019.0
14,Environment,Electricity production from coal sources ,E1_Income support,Moldova,MDA,0.0,percent of total,2015.0
15,Environment,"Adjusted net savings, including particulate emission damage",E1_Income support,Moldova,MDA,4.58910436524494,percent of GNI,2018.0
16,Environment,Combustible renewables and waste,E1_Income support,Moldova,MDA,8.329097,percent of total energy,2014.0
17,Health,Prevalence of obesity,E1_Income support,Moldova,MDA,18.9,percent,2016.0
18,Demographics,Fixed broadband subscriptions,E1_Income support,Moldova,MDA,16.5839,per 100 people,2019.0
19,Health,"Immunization, DPT (% of children ages 12-23 months)",E1_Income support,Moldova,MDA,91.0,percent,2019.0
20,Governance,Human Development Index,E1_Income support,Moldova,MDA,0.75,index,2019.0
21,Governance,Rule of law estimate ,E1_Income support,Moldova,MDA,-0.3730286,score,2019.0
22,Demographics,Fixed telephone subscriptions,E1_Income support,Moldova,MDA,1071510.0,number,2019.0
24,Environment,Energy use (kg of oil equivalent per capita),E1_Income support,Moldova,MDA,1155.612453840634,kg of oil equivalent per capita,2014.0
25,Social issues ,Gini index (World Bank estimate),E1_Income support,Moldova,MDA,25.7,index ,2018.0
26,Environment,Electricity production from oil sources,E1_Income support,Moldova,MDA,0.1477589886718109,percent of total,2015.0
27,Health,Prevalence of anxiety disorders,E1_Income support,Moldova,MDA,0.047396,percent,2019.0
28,Economics,Employment in services (% of total employment) (modeled ILO estimate),E1_Income support,Moldova,MDA,47.5349998,Percentage of total employment,2020.0
30,Economics,"Labor force participation rate, total (% of total population ages 15+) (modeled ILO estimate)",E1_Income support,Moldova,MDA,42.7360001,Percentage of total population,2020.0
31,Health,Prevalence of Hypertensive heart disease,E1_Income support,Moldova,MDA,0.001578,percent,2019.0
32,Health,"Incidence of tuberculosis (per 100,000 people)",E1_Income support,Moldova,MDA,80.0,Cases,2019.0
33,Social issues ,Press freedom score,E1_Income support,Moldova,MDA,31.16,score,2020.0
34,Governance,Corruption Perceptions Index,E1_Income support,Moldova,MDA,34.0,score,2020.0
35,Health,Prevalence of chronic kidney disease,E1_Income support,Moldova,MDA,0.130119,percent,2019.0
36,Governance,Government effectiveness estimate,E1_Income support,Moldova,MDA,-0.3834049,score,2019.0
38,Environment,"PM2.5 air pollution, mean annual exposure",E1_Income support,Moldova,MDA,16.25103,micrograms per cubic meter,2017.0
39,Governance,Aggregate score for the Civil Liberties category,E1_Income support,Moldova,MDA,35.0,score,2021.0
40,Governance,Serious assault (rate),E1_Income support,Moldova,MDA,5.08,rate,2018.0
41,Environment,Renewable energy consumption ,E1_Income support,Moldova,MDA,14.2736887091697,percent of total final energy consumption,2015.0
42,Health,"Prevalence of HIV, total (% of population ages 15-49)",E1_Income support,Moldova,MDA,0.7,percent,2019.0
43,Environment,Electric power consumption ,E1_Income support,Moldova,MDA,1725.61647911234,kWh per capita,2014.0
44,Governance,Fragile States Index Total ,E1_Income support,Moldova,MDA,65.97954327737929,score,2020.0
45,Economics,"Labor force participation rate, female (% of female population ages 15+) (modeled ILO estimate)",E1_Income support,Moldova,MDA,40.0180016,Percentage of females of the total population,2020.0
46,Environment,CO2 emissions (metric tons per capita),E1_Income support,Moldova,MDA,1.825537,metric tons per capita,2016.0
47,Health,Mortality due to COVID-19,E1_Income support,Moldova,MDA,2700.0,"Number (cumulative total by Dec 26,2020)",2020.0
48,Social issues ,Proportion of women in managerial positions (%),E1_Income support,Moldova,MDA,40.49,percent,2018.0
49,Health,"Prevalence of stunting, height for age (modeled estimate, % of children under 5)",E1_Income support,Moldova,MDA,4.9,percent,2020.0
50,Health,Prevalence of total cancers,E1_Income support,Moldova,MDA,0.013282,percent,2019.0
51,Economics,Volume of imports,E1_Income support,Moldova,MDA,5.61,percent change,2020.0
52,Environment,Access to electricity ,E1_Income support,Moldova,MDA,100.0,percent of population,2018.0
53,Economics,"Unemployment, total (% of total labor force) (modeled ILO estimate)",E1_Income support,Moldova,MDA,5.36499977,percent of total labor force,2020.0
54,Health,"Prevalence of overweight (modeled estimate, % of children under 5)",E1_Income support,Moldova,MDA,4.3,percent,2020.0
55,Governance,Human Freedom Score ,E1_Income support,Moldova,MDA,7.18,score,2018.0
56,Health,"Physicians (per 1,000 people)",E1_Income support,Moldova,MDA,3.2066,Ones,2017.0
58,Governance,Personal Freedom Score ,E1_Income support,Moldova,MDA,7.37,score,2018.0
61,Health,Prevalence of Diabetes,E1_Income support,Moldova,MDA,0.068608,percent,2019.0
65,Environment,"Electricity production from renewable sources, excluding hydroelectric",E1_Income support,Moldova,MDA,19000000.0,kWh,2015.0
66,Governance,Control of corruption estimate,E1_Income support,Moldova,MDA,-0.6186848,score,2019.0
67,Environment,"Energy imports, net ",E1_Income support,Moldova,MDA,90.01107669269402,percent of energy use,2014.0
68,Health,"Nurses and midwives (per 1,000 people)",E1_Income support,Moldova,MDA,4.9235,Ones,2017.0
69,Environment,Electricity production from nuclear sources ,E1_Income support,Moldova,MDA,0.0,percent of total,2014.0
70,Governance,Aggregate score for the Political Rights category,E1_Income support,Moldova,MDA,26.0,score,2021.0
72,Health,Prevalence of down syndrome,E1_Income support,Moldova,MDA,0.000196,percent,2019.0
73,Governance,Regulatory quality estimate,E1_Income support,Moldova,MDA,0.0097867,score,2019.0
74,Environment,"Electricity production from oil, gas and coal sources",E1_Income support,Moldova,MDA,94.63142341159087,percent of total,2015.0
75,Governance,Political stability and absence of violence/terrorism estimate,E1_Income support,Moldova,MDA,-0.3827971,score,2019.0
78,Demographics,Mobile cellular subscriptions,E1_Income support,Moldova,MDA,89.3794,per 100 people,2019.0
80,Governance,"CPIA transparency, accountability, and corruption in the public sector rating (1=low to 6=high)",E1_Income support,Moldova,MDA,2.5,rating,2019.0
81,Health,Prevalence of Respiratory infections and tuberculosis,E1_Income support,Moldova,MDA,0.254663,percent,2019.0
82,Health,"Immunization, measles (% of children ages 12-23 months)",E1_Income support,Moldova,MDA,97.0,percent,2019.0
83,Environment,Fossil fuel energy consumption,E1_Income support,Moldova,MDA,88.68802,percent of total,2014.0
85,Governance,Voice and accountability estimate,E1_Income support,Moldova,MDA,-0.0899362,score,2019.0
86,Environment,Energy use ,E1_Income support,Moldova,MDA,112.0386423508605,"(kg of oil equivalent) per $1,000 GDP (constant 2017 PPP)",2014.0
91,Social issues ,Proportion of seats held by women in national parliaments (%),E1_Income support,Moldova,MDA,24.75247525,proportion,2020.0
94,Economics,"Central government debt, total",E1_Income support,Moldova,MDA,31.88566926065229,percent of GDP,2016.0
110,Environment,"PM2.5 air pollution, population exposed to levels exceeding WHO guideline value ",E1_Income support,Moldova,MDA,100.0,percent of total,2017.0
112,Health,Domestic General Government Health Expenditure (GGHE-D) as % General Government Expenditure (GGE),E1_Income support,Moldova,MDA,3.7,percent,2018.0
