rank,Category,Indicator,Policy,Country,ISO,value,unit,year
30,Governance,Political stability and absence of violence/terrorism estimate,C4_Restrictions on gatherings,Anguilla,AIA,1.367357,score,2019.0
31,Health,Prevalence of COVID-19,C4_Restrictions on gatherings,Anguilla,AIA,10.0,"Number (cumulative total by Dec 26,2020)",2020.0
38,Governance,Rule of law estimate ,C4_Restrictions on gatherings,Anguilla,AIA,0.3557367,score,2019.0
46,Health,Mortality due to COVID-19,C4_Restrictions on gatherings,Anguilla,AIA,0.0,"Number (cumulative total by Dec 26,2020)",2020.0
53,Governance,Regulatory quality estimate,C4_Restrictions on gatherings,Anguilla,AIA,0.8462311,score,2019.0
60,Governance,Control of corruption estimate,C4_Restrictions on gatherings,Anguilla,AIA,1.234392,score,2019.0
78,Governance,Government effectiveness estimate,C4_Restrictions on gatherings,Anguilla,AIA,0.8158239,score,2019.0
