rank,Category,Indicator,Policy,Country,ISO,value,unit,year
1,Demographics,Individuals using the Internet,C4_Restrictions on gatherings,Barbados,BRB,81.7608,percent of population,2019.0
2,Governance,Corruption Perceptions Index,C4_Restrictions on gatherings,Barbados,BRB,64.0,score,2020.0
3,Demographics,Secure Internet servers ,C4_Restrictions on gatherings,Barbados,BRB,940.6846093545857,per 1 million people,2019.0
4,Demographics,Fixed broadband subscriptions,C4_Restrictions on gatherings,Barbados,BRB,37.2103,per 100 people,2019.0
7,Environment,"Adjusted net savings, including particulate emission damage",C4_Restrictions on gatherings,Barbados,BRB,-0.626937448351921,percent of GNI,2016.0
8,Governance,Economic Freedom Score,C4_Restrictions on gatherings,Barbados,BRB,6.22,score,2018.0
9,Governance,Fragile States Index Total ,C4_Restrictions on gatherings,Barbados,BRB,46.40725753500914,score,2020.0
10,Environment,CO2 emissions (kt),C4_Restrictions on gatherings,Barbados,BRB,1276.116,kt,2016.0
11,Governance,Voice and accountability estimate,C4_Restrictions on gatherings,Barbados,BRB,1.131867,score,2019.0
12,Economics,Employment in services (% of total employment) (modeled ILO estimate),C4_Restrictions on gatherings,Barbados,BRB,78.5100021,Percentage of total employment,2020.0
13,Health,Summary exposure value tobacco,C4_Restrictions on gatherings,Barbados,BRB,10.06039,Rate (risk-weighted prevalence),2019.0
14,Economics,Volume of imports,C4_Restrictions on gatherings,Barbados,BRB,2.294,percent change,2020.0
15,Health,Domestic General Government Health Expenditure (GGHE-D) as % General Government Expenditure (GGE),C4_Restrictions on gatherings,Barbados,BRB,2.9,percent,2018.0
16,Governance,Serious assault (rate),C4_Restrictions on gatherings,Barbados,BRB,502.05,rate,2017.0
17,Health,"Incidence of tuberculosis (per 100,000 people)",C4_Restrictions on gatherings,Barbados,BRB,0.0,Cases,2019.0
18,Health,"Immunization, DPT (% of children ages 12-23 months)",C4_Restrictions on gatherings,Barbados,BRB,90.0,percent,2019.0
19,Governance,Human Development Index,C4_Restrictions on gatherings,Barbados,BRB,0.814,index,2019.0
20,Economics,"Labor force participation rate, total (% of total population ages 15+) (modeled ILO estimate)",C4_Restrictions on gatherings,Barbados,BRB,64.901001,Percentage of total population,2020.0
21,Health,Prevalence of anxiety disorders,C4_Restrictions on gatherings,Barbados,BRB,0.049347,percent,2019.0
23,Governance,Total freedom in the world score ,C4_Restrictions on gatherings,Barbados,BRB,95.0,score,2021.0
24,Social issues ,Net migration,C4_Restrictions on gatherings,Barbados,BRB,-397.0,net total / data are 5 year estimates,2019.0
25,Social issues ,Proportion of seats held by women in national parliaments (%),C4_Restrictions on gatherings,Barbados,BRB,20.0,proportion,2020.0
26,Health,"Immunization, measles (% of children ages 12-23 months)",C4_Restrictions on gatherings,Barbados,BRB,92.0,percent,2019.0
27,Health,Prevalence of Respiratory infections and tuberculosis,C4_Restrictions on gatherings,Barbados,BRB,0.245301,percent,2019.0
28,Health,"Nurses and midwives (per 1,000 people)",C4_Restrictions on gatherings,Barbados,BRB,3.06,Ones,2018.0
29,Demographics,Mobile cellular subscriptions,C4_Restrictions on gatherings,Barbados,BRB,108.609,per 100 people,2019.0
30,Governance,Political stability and absence of violence/terrorism estimate,C4_Restrictions on gatherings,Barbados,BRB,0.9417337,score,2019.0
31,Health,Prevalence of COVID-19,C4_Restrictions on gatherings,Barbados,BRB,305.0,"Number (cumulative total by Dec 26,2020)",2020.0
32,Economics,"Central government debt, total",C4_Restrictions on gatherings,Barbados,BRB,141.7288148568399,percent of GDP,2015.0
33,Governance,Aggregate score for the Civil Liberties category,C4_Restrictions on gatherings,Barbados,BRB,57.0,score,2021.0
34,Social issues ,"Intentional homicides (per 100,000 people)",C4_Restrictions on gatherings,Barbados,BRB,9.7683505442,"proportion, pero 100,000 people",2018.0
37,Governance,Human Freedom Score ,C4_Restrictions on gatherings,Barbados,BRB,6.99,score,2018.0
38,Governance,Rule of law estimate ,C4_Restrictions on gatherings,Barbados,BRB,0.3570292,score,2019.0
41,Health,"Prevalence of stunting, height for age (modeled estimate, % of children under 5)",C4_Restrictions on gatherings,Barbados,BRB,6.6,percent,2020.0
42,Health,"Physicians (per 1,000 people)",C4_Restrictions on gatherings,Barbados,BRB,2.4843,Ones,2017.0
44,Health,"Prevalence of HIV, total (% of population ages 15-49)",C4_Restrictions on gatherings,Barbados,BRB,0.8,percent,2019.0
45,Social issues ,Proportion of women in managerial positions (%),C4_Restrictions on gatherings,Barbados,BRB,48.6,percent,2016.0
46,Health,Mortality due to COVID-19,C4_Restrictions on gatherings,Barbados,BRB,7.0,"Number (cumulative total by Dec 26,2020)",2020.0
48,Environment,Access to electricity ,C4_Restrictions on gatherings,Barbados,BRB,100.0,percent of population,2018.0
49,Environment,CO2 emissions (metric tons per capita),C4_Restrictions on gatherings,Barbados,BRB,4.465129,metric tons per capita,2016.0
50,Economics,"Unemployment, total (% of total labor force) (modeled ILO estimate)",C4_Restrictions on gatherings,Barbados,BRB,10.9379997,percent of total labor force,2020.0
52,Demographics,People using at least basic sanitation services (% of population),C4_Restrictions on gatherings,Barbados,BRB,97.2793784985907,proportion,2017.0
53,Governance,Regulatory quality estimate,C4_Restrictions on gatherings,Barbados,BRB,0.412301,score,2019.0
54,Health,Prevalence of down syndrome,C4_Restrictions on gatherings,Barbados,BRB,0.000224,percent,2019.0
56,Health,Prevalence of Depressive disorders,C4_Restrictions on gatherings,Barbados,BRB,0.039605,percent,2019.0
57,Demographics,Fixed telephone subscriptions,C4_Restrictions on gatherings,Barbados,BRB,138312.0,number,2019.0
58,Environment,Renewable energy consumption ,C4_Restrictions on gatherings,Barbados,BRB,2.78635820637435,percent of total final energy consumption,2015.0
59,Economics,Volume of exports,C4_Restrictions on gatherings,Barbados,BRB,2.911,percent change,2020.0
60,Governance,Control of corruption estimate,C4_Restrictions on gatherings,Barbados,BRB,1.261709,score,2019.0
61,Social issues ,Proportion of population spending more than 10% of household consumption or income on out-of-pocket health care expenditure (%),C4_Restrictions on gatherings,Barbados,BRB,16.3744926452637,proportion,2016.0
63,Demographics,"Age dependency ratio, old (% of working-age population)",C4_Restrictions on gatherings,Barbados,BRB,24.32754218037692,proportion,2019.0
64,Health,Prevalence of obesity,C4_Restrictions on gatherings,Barbados,BRB,23.1,percent,2016.0
65,Health,"Prevalence of overweight (modeled estimate, % of children under 5)",C4_Restrictions on gatherings,Barbados,BRB,11.4,percent,2020.0
67,Social issues ,"Primary completion rate, total (% of relevant age group)",C4_Restrictions on gatherings,Barbados,BRB,90.0936737060547,proportion,2019.0
68,Governance,Personal Freedom Score ,C4_Restrictions on gatherings,Barbados,BRB,7.76,score,2018.0
69,Governance,Aggregate score for the Political Rights category,C4_Restrictions on gatherings,Barbados,BRB,38.0,score,2021.0
70,Health,Prevalence of Hypertensive heart disease,C4_Restrictions on gatherings,Barbados,BRB,0.003869,percent,2019.0
71,Health,Prevalence of total cancers,C4_Restrictions on gatherings,Barbados,BRB,0.028345,percent,2019.0
74,Health,Prevalence of chronic kidney disease,C4_Restrictions on gatherings,Barbados,BRB,0.132863,percent,2019.0
75,Social issues ,Proportion of population pushed below the $1.90 ($ 2011 PPP) poverty line by out-of-pocket health care expenditure (%),C4_Restrictions on gatherings,Barbados,BRB,0.336767345666885,proportion,2016.0
76,Health,Prevalence of Diabetes,C4_Restrictions on gatherings,Barbados,BRB,0.123307,percent,2019.0
78,Governance,Government effectiveness estimate,C4_Restrictions on gatherings,Barbados,BRB,0.631425,score,2019.0
79,Economics,"Labor force participation rate, female (% of female population ages 15+) (modeled ILO estimate)",C4_Restrictions on gatherings,Barbados,BRB,61.4000015,Percentage of females of the total population,2020.0
80,Environment,"PM2.5 air pollution, mean annual exposure",C4_Restrictions on gatherings,Barbados,BRB,23.08018,micrograms per cubic meter,2017.0
82,Demographics,Urban population (% of total population),C4_Restrictions on gatherings,Barbados,BRB,31.158,total,2019.0
84,Demographics,Age dependency ratio (% of working-age population),C4_Restrictions on gatherings,Barbados,BRB,49.88328920777654,proportion,2019.0
87,Social issues ,"Literacy rate, adult total (% of people ages 15 and above)",C4_Restrictions on gatherings,Barbados,BRB,99.5999984741211,proportion,2014.0
88,Environment,"PM2.5 air pollution, population exposed to levels exceeding WHO guideline value ",C4_Restrictions on gatherings,Barbados,BRB,100.0,percent of total,2017.0
92,Demographics,"Population, total",C4_Restrictions on gatherings,Barbados,BRB,287025.0,total,2019.0
111,Demographics,Rural population (% of total population),C4_Restrictions on gatherings,Barbados,BRB,68.842,proportion,2019.0
116,Demographics,People with basic handwashing facilities including soap and water (% of population),C4_Restrictions on gatherings,Barbados,BRB,88.4693506083686,proportion,2016.0
