rank,Category,Indicator,Policy,Country,ISO,value,unit,year
1,Demographics,Individuals using the Internet,C4_Restrictions on gatherings,Gambia,GMB,19.8365,percent of population,2019.0
2,Governance,Corruption Perceptions Index,C4_Restrictions on gatherings,Gambia,GMB,37.0,score,2020.0
3,Demographics,Secure Internet servers ,C4_Restrictions on gatherings,Gambia,GMB,22.1492810428563,per 1 million people,2019.0
4,Demographics,Fixed broadband subscriptions,C4_Restrictions on gatherings,Gambia,GMB,0.194422,per 100 people,2019.0
6,Social issues ,Press freedom score,C4_Restrictions on gatherings,Gambia,GMB,30.62,score,2020.0
7,Environment,"Adjusted net savings, including particulate emission damage",C4_Restrictions on gatherings,Gambia,GMB,-7.83852285258373,percent of GNI,2018.0
8,Governance,Economic Freedom Score,C4_Restrictions on gatherings,Gambia,GMB,7.14,score,2018.0
9,Governance,Fragile States Index Total ,C4_Restrictions on gatherings,Gambia,GMB,82.21463956781182,score,2020.0
10,Environment,CO2 emissions (kt),C4_Restrictions on gatherings,Gambia,GMB,531.715,kt,2016.0
11,Governance,Voice and accountability estimate,C4_Restrictions on gatherings,Gambia,GMB,-0.2162317,score,2019.0
12,Economics,Employment in services (% of total employment) (modeled ILO estimate),C4_Restrictions on gatherings,Gambia,GMB,57.6599998,Percentage of total employment,2020.0
13,Health,Summary exposure value tobacco,C4_Restrictions on gatherings,Gambia,GMB,20.67008,Rate (risk-weighted prevalence),2019.0
14,Economics,Volume of imports,C4_Restrictions on gatherings,Gambia,GMB,6.299,percent change,2020.0
15,Health,Domestic General Government Health Expenditure (GGHE-D) as % General Government Expenditure (GGE),C4_Restrictions on gatherings,Gambia,GMB,0.9,percent,2018.0
17,Health,"Incidence of tuberculosis (per 100,000 people)",C4_Restrictions on gatherings,Gambia,GMB,158.0,Cases,2019.0
18,Health,"Immunization, DPT (% of children ages 12-23 months)",C4_Restrictions on gatherings,Gambia,GMB,88.0,percent,2019.0
19,Governance,Human Development Index,C4_Restrictions on gatherings,Gambia,GMB,0.496,index,2019.0
20,Economics,"Labor force participation rate, total (% of total population ages 15+) (modeled ILO estimate)",C4_Restrictions on gatherings,Gambia,GMB,59.5550003,Percentage of total population,2020.0
21,Health,Prevalence of anxiety disorders,C4_Restrictions on gatherings,Gambia,GMB,0.032372,percent,2019.0
23,Governance,Total freedom in the world score ,C4_Restrictions on gatherings,Gambia,GMB,46.0,score,2021.0
24,Social issues ,Net migration,C4_Restrictions on gatherings,Gambia,GMB,-15436.0,net total / data are 5 year estimates,2019.0
25,Social issues ,Proportion of seats held by women in national parliaments (%),C4_Restrictions on gatherings,Gambia,GMB,8.620689655,proportion,2020.0
26,Health,"Immunization, measles (% of children ages 12-23 months)",C4_Restrictions on gatherings,Gambia,GMB,85.0,percent,2019.0
27,Health,Prevalence of Respiratory infections and tuberculosis,C4_Restrictions on gatherings,Gambia,GMB,0.198757,percent,2019.0
28,Health,"Nurses and midwives (per 1,000 people)",C4_Restrictions on gatherings,Gambia,GMB,1.5447,Ones,2015.0
29,Demographics,Mobile cellular subscriptions,C4_Restrictions on gatherings,Gambia,GMB,139.529,per 100 people,2019.0
30,Governance,Political stability and absence of violence/terrorism estimate,C4_Restrictions on gatherings,Gambia,GMB,0.1114135,score,2019.0
31,Health,Prevalence of COVID-19,C4_Restrictions on gatherings,Gambia,GMB,3786.0,"Number (cumulative total by Dec 26,2020)",2020.0
33,Governance,Aggregate score for the Civil Liberties category,C4_Restrictions on gatherings,Gambia,GMB,26.0,score,2021.0
37,Governance,Human Freedom Score ,C4_Restrictions on gatherings,Gambia,GMB,6.27,score,2018.0
38,Governance,Rule of law estimate ,C4_Restrictions on gatherings,Gambia,GMB,-0.3715761,score,2019.0
41,Health,"Prevalence of stunting, height for age (modeled estimate, % of children under 5)",C4_Restrictions on gatherings,Gambia,GMB,16.1,percent,2020.0
42,Health,"Physicians (per 1,000 people)",C4_Restrictions on gatherings,Gambia,GMB,0.1021,Ones,2015.0
44,Health,"Prevalence of HIV, total (% of population ages 15-49)",C4_Restrictions on gatherings,Gambia,GMB,1.9,percent,2019.0
46,Health,Mortality due to COVID-19,C4_Restrictions on gatherings,Gambia,GMB,123.0,"Number (cumulative total by Dec 26,2020)",2020.0
48,Environment,Access to electricity ,C4_Restrictions on gatherings,Gambia,GMB,60.3,percent of population,2018.0
49,Environment,CO2 emissions (metric tons per capita),C4_Restrictions on gatherings,Gambia,GMB,0.247408,metric tons per capita,2016.0
50,Economics,"Unemployment, total (% of total labor force) (modeled ILO estimate)",C4_Restrictions on gatherings,Gambia,GMB,9.10700035,percent of total labor force,2020.0
51,Social issues ,Life Ladder ,C4_Restrictions on gatherings,Gambia,GMB,5.051000118255615,score,2021.0
53,Governance,Regulatory quality estimate,C4_Restrictions on gatherings,Gambia,GMB,-0.6649198,score,2019.0
54,Health,Prevalence of down syndrome,C4_Restrictions on gatherings,Gambia,GMB,0.000173,percent,2019.0
56,Health,Prevalence of Depressive disorders,C4_Restrictions on gatherings,Gambia,GMB,0.042125,percent,2019.0
57,Demographics,Fixed telephone subscriptions,C4_Restrictions on gatherings,Gambia,GMB,44000.0,number,2019.0
58,Environment,Renewable energy consumption ,C4_Restrictions on gatherings,Gambia,GMB,51.5088624939659,percent of total final energy consumption,2015.0
59,Economics,Volume of exports,C4_Restrictions on gatherings,Gambia,GMB,11.415,percent change,2020.0
60,Governance,Control of corruption estimate,C4_Restrictions on gatherings,Gambia,GMB,-0.2852226,score,2019.0
64,Health,Prevalence of obesity,C4_Restrictions on gatherings,Gambia,GMB,10.3,percent,2016.0
65,Health,"Prevalence of overweight (modeled estimate, % of children under 5)",C4_Restrictions on gatherings,Gambia,GMB,2.3,percent,2020.0
68,Governance,Personal Freedom Score ,C4_Restrictions on gatherings,Gambia,GMB,5.4,score,2018.0
69,Governance,Aggregate score for the Political Rights category,C4_Restrictions on gatherings,Gambia,GMB,20.0,score,2021.0
70,Health,Prevalence of Hypertensive heart disease,C4_Restrictions on gatherings,Gambia,GMB,0.000957,percent,2019.0
71,Health,Prevalence of total cancers,C4_Restrictions on gatherings,Gambia,GMB,0.001556,percent,2019.0
74,Health,Prevalence of chronic kidney disease,C4_Restrictions on gatherings,Gambia,GMB,0.040879,percent,2019.0
76,Health,Prevalence of Diabetes,C4_Restrictions on gatherings,Gambia,GMB,0.020017,percent,2019.0
78,Governance,Government effectiveness estimate,C4_Restrictions on gatherings,Gambia,GMB,-0.630676,score,2019.0
79,Economics,"Labor force participation rate, female (% of female population ages 15+) (modeled ILO estimate)",C4_Restrictions on gatherings,Gambia,GMB,51.3660011,Percentage of females of the total population,2020.0
80,Environment,"PM2.5 air pollution, mean annual exposure",C4_Restrictions on gatherings,Gambia,GMB,33.98264,micrograms per cubic meter,2017.0
83,Governance,"CPIA transparency, accountability, and corruption in the public sector rating (1=low to 6=high)",C4_Restrictions on gatherings,Gambia,GMB,2.5,rating,2019.0
88,Environment,"PM2.5 air pollution, population exposed to levels exceeding WHO guideline value ",C4_Restrictions on gatherings,Gambia,GMB,100.0,percent of total,2017.0
106,Social issues ,Gini index (World Bank estimate),C4_Restrictions on gatherings,Gambia,GMB,35.9,index ,2015.0
