rank,Category,Indicator,Policy,Country,ISO,value,unit,year
1,Demographics,Individuals using the Internet,C5_Close public transport,Iceland,ISL,99.011,percent of population,2019.0
2,Governance,Corruption Perceptions Index,C5_Close public transport,Iceland,ISL,75.0,score,2020.0
3,Health,Prevalence of COVID-19,C5_Close public transport,Iceland,ISL,5604.0,"Number (cumulative total by Dec 26,2020)",2020.0
4,Demographics,Secure Internet servers ,C5_Close public transport,Iceland,ISL,70758.594348944,per 1 million people,2019.0
6,Health,Mortality due to COVID-19,C5_Close public transport,Iceland,ISL,28.0,"Number (cumulative total by Dec 26,2020)",2020.0
7,Social issues ,Net migration,C5_Close public transport,Iceland,ISL,1900.0,net total / data are 5 year estimates,2019.0
8,Governance,Aggregate score for the Political Rights category,C5_Close public transport,Iceland,ISL,37.0,score,2021.0
9,Social issues ,Life Ladder ,C5_Close public transport,Iceland,ISL,7.553899765014648,score,2021.0
10,Health,Prevalence of anxiety disorders,C5_Close public transport,Iceland,ISL,0.056667,percent,2019.0
11,Demographics,Fixed broadband subscriptions,C5_Close public transport,Iceland,ISL,40.783,per 100 people,2019.0
12,Social issues ,Gini index (World Bank estimate),C5_Close public transport,Iceland,ISL,26.8,index ,2015.0
13,Health,Summary exposure value tobacco,C5_Close public transport,Iceland,ISL,26.84943,Rate (risk-weighted prevalence),2019.0
14,Health,Prevalence of Diabetes,C5_Close public transport,Iceland,ISL,0.072034,percent,2019.0
15,Governance,Aggregate score for the Civil Liberties category,C5_Close public transport,Iceland,ISL,57.0,score,2021.0
16,Health,"Physicians (per 1,000 people)",C5_Close public transport,Iceland,ISL,4.0778,Ones,2018.0
17,Environment,CO2 emissions (kt),C5_Close public transport,Iceland,ISL,2064.521,kt,2016.0
18,Environment,Electricity production from coal sources ,C5_Close public transport,Iceland,ISL,0.0,percent of total,2015.0
19,Health,Prevalence of Respiratory infections and tuberculosis,C5_Close public transport,Iceland,ISL,0.115837,percent,2019.0
20,Environment,Renewable energy consumption ,C5_Close public transport,Iceland,ISL,77.029689205553,percent of total final energy consumption,2015.0
21,Environment,"Energy imports, net ",C5_Close public transport,Iceland,ISL,11.55755169241199,percent of energy use,2015.0
22,Health,"Incidence of tuberculosis (per 100,000 people)",C5_Close public transport,Iceland,ISL,4.4,Cases,2019.0
23,Environment,"Adjusted net savings, including particulate emission damage",C5_Close public transport,Iceland,ISL,10.9603888578802,percent of GNI,2018.0
24,Social issues ,Proportion of seats held by women in national parliaments (%),C5_Close public transport,Iceland,ISL,38.0952381,proportion,2020.0
25,Economics,"Central government debt, total",C5_Close public transport,Iceland,ISL,73.52782995610531,percent of GDP,2016.0
26,Environment,"PM2.5 air pollution, mean annual exposure",C5_Close public transport,Iceland,ISL,6.481147,micrograms per cubic meter,2017.0
27,Health,"Nurses and midwives (per 1,000 people)",C5_Close public transport,Iceland,ISL,16.2132,Ones,2018.0
28,Environment,Electric power consumption ,C5_Close public transport,Iceland,ISL,53832.47909195873,kWh per capita,2014.0
29,Demographics,Mobile cellular subscriptions,C5_Close public transport,Iceland,ISL,121.949,per 100 people,2019.0
30,Health,Prevalence of chronic kidney disease,C5_Close public transport,Iceland,ISL,0.079889,percent,2019.0
31,Economics,Employment in services (% of total employment) (modeled ILO estimate),C5_Close public transport,Iceland,ISL,80.064003,Percentage of total employment,2020.0
32,Environment,Electricity production from oil sources,C5_Close public transport,Iceland,ISL,0.0212777275386989,percent of total,2015.0
33,Social issues ,Proportion of women in managerial positions (%),C5_Close public transport,Iceland,ISL,41.46,percent,2018.0
34,Economics,Volume of imports,C5_Close public transport,Iceland,ISL,3.283,percent change,2020.0
35,Health,Prevalence of total cancers,C5_Close public transport,Iceland,ISL,0.029362,percent,2019.0
36,Governance,Rule of law estimate ,C5_Close public transport,Iceland,ISL,1.766924,score,2019.0
37,Health,Prevalence of down syndrome,C5_Close public transport,Iceland,ISL,0.000652,percent,2019.0
39,Governance,Political stability and absence of violence/terrorism estimate,C5_Close public transport,Iceland,ISL,1.655899,score,2019.0
41,Health,Prevalence of Hypertensive heart disease,C5_Close public transport,Iceland,ISL,0.0013,percent,2019.0
42,Health,Prevalence of Depressive disorders,C5_Close public transport,Iceland,ISL,0.035238,percent,2019.0
43,Economics,"Unemployment, total (% of total labor force) (modeled ILO estimate)",C5_Close public transport,Iceland,ISL,3.22199988,percent of total labor force,2020.0
45,Environment,"PM2.5 air pollution, population exposed to levels exceeding WHO guideline value ",C5_Close public transport,Iceland,ISL,10.2852157949761,percent of total,2017.0
46,Environment,Energy use (kg of oil equivalent per capita),C5_Close public transport,Iceland,ISL,17478.89303689373,kg of oil equivalent per capita,2015.0
47,Governance,Serious assault (rate),C5_Close public transport,Iceland,ISL,36.23,rate,2018.0
48,Governance,Personal Freedom Score ,C5_Close public transport,Iceland,ISL,9.06,score,2018.0
50,Governance,Regulatory quality estimate,C5_Close public transport,Iceland,ISL,1.372984,score,2019.0
51,Health,Prevalence of obesity,C5_Close public transport,Iceland,ISL,21.9,percent,2016.0
52,Governance,Government effectiveness estimate,C5_Close public transport,Iceland,ISL,1.518278,score,2019.0
53,Governance,Voice and accountability estimate,C5_Close public transport,Iceland,ISL,1.333944,score,2019.0
54,Governance,Human Freedom Score ,C5_Close public transport,Iceland,ISL,8.39,score,2018.0
55,Health,"Immunization, DPT (% of children ages 12-23 months)",C5_Close public transport,Iceland,ISL,91.0,percent,2019.0
56,Social issues ,Press freedom score,C5_Close public transport,Iceland,ISL,15.12,score,2020.0
57,Governance,Economic Freedom Score,C5_Close public transport,Iceland,ISL,7.71,score,2018.0
58,Economics,"Labor force participation rate, total (% of total population ages 15+) (modeled ILO estimate)",C5_Close public transport,Iceland,ISL,74.7509995,Percentage of total population,2020.0
59,Environment,Energy use ,C5_Close public transport,Iceland,ISL,337.8254095943539,"(kg of oil equivalent) per $1,000 GDP (constant 2017 PPP)",2015.0
60,Governance,Human Development Index,C5_Close public transport,Iceland,ISL,0.949,index,2019.0
62,Governance,Total freedom in the world score ,C5_Close public transport,Iceland,ISL,94.0,score,2021.0
64,Governance,Control of corruption estimate,C5_Close public transport,Iceland,ISL,1.707973,score,2019.0
65,Environment,"Electricity production from oil, gas and coal sources",C5_Close public transport,Iceland,ISL,0.0212777275386989,percent of total,2015.0
67,Social issues ,"Intentional homicides (per 100,000 people)",C5_Close public transport,Iceland,ISL,0.89096913683,"proportion, pero 100,000 people",2018.0
68,Economics,"Labor force participation rate, female (% of female population ages 15+) (modeled ILO estimate)",C5_Close public transport,Iceland,ISL,70.6110001,Percentage of females of the total population,2020.0
71,Demographics,Fixed telephone subscriptions,C5_Close public transport,Iceland,ISL,125567.0,number,2019.0
72,Environment,"Electricity production from renewable sources, excluding hydroelectric",C5_Close public transport,Iceland,ISL,5014000000.0,kWh,2015.0
73,Environment,Fossil fuel energy consumption,C5_Close public transport,Iceland,ISL,11.28887,percent of total,2015.0
76,Health,"Immunization, measles (% of children ages 12-23 months)",C5_Close public transport,Iceland,ISL,93.0,percent,2019.0
79,Health,Domestic General Government Health Expenditure (GGHE-D) as % General Government Expenditure (GGE),C5_Close public transport,Iceland,ISL,7.0,percent,2018.0
81,Environment,CO2 emissions (metric tons per capita),C5_Close public transport,Iceland,ISL,6.154684,metric tons per capita,2016.0
82,Governance,Fragile States Index Total ,C5_Close public transport,Iceland,ISL,17.799999999999997,score,2020.0
88,Economics,Volume of exports,C5_Close public transport,Iceland,ISL,2.6,percent change,2020.0
98,Environment,Electricity production from nuclear sources ,C5_Close public transport,Iceland,ISL,0.0,percent of total,2015.0
112,Environment,Combustible renewables and waste,C5_Close public transport,Iceland,ISL,0.234285,percent of total energy,2015.0
117,Environment,Access to electricity ,C5_Close public transport,Iceland,ISL,100.0,percent of population,2018.0
