rank,Category,Indicator,Policy,Country,ISO,value,unit,year
1,Demographics,Individuals using the Internet,C3_Cancel public events,Egypt,EGY,57.2829,percent of population,2019.0
2,Demographics,Fixed telephone subscriptions,C3_Cancel public events,Egypt,EGY,8760440.0,number,2019.0
3,Health,Prevalence of Respiratory infections and tuberculosis,C3_Cancel public events,Egypt,EGY,0.31957,percent,2019.0
4,Health,Prevalence of COVID-19,C3_Cancel public events,Egypt,EGY,124280.0,"Number (cumulative total by Dec 26,2020)",2020.0
5,Governance,Rule of law estimate ,C3_Cancel public events,Egypt,EGY,-0.420846,score,2019.0
6,Health,"Incidence of tuberculosis (per 100,000 people)",C3_Cancel public events,Egypt,EGY,12.0,Cases,2019.0
7,Environment,Fossil fuel energy consumption,C3_Cancel public events,Egypt,EGY,97.92893,percent of total,2014.0
8,Health,Prevalence of anxiety disorders,C3_Cancel public events,Egypt,EGY,0.048597,percent,2019.0
9,Demographics,Fixed broadband subscriptions,C3_Cancel public events,Egypt,EGY,7.56957,per 100 people,2019.0
10,Governance,Economic Freedom Score,C3_Cancel public events,Egypt,EGY,5.38,score,2018.0
11,Environment,Renewable energy consumption ,C3_Cancel public events,Egypt,EGY,5.70937726460422,percent of total final energy consumption,2015.0
12,Governance,Government effectiveness estimate,C3_Cancel public events,Egypt,EGY,-0.4235377,score,2019.0
13,Health,Prevalence of Diabetes,C3_Cancel public events,Egypt,EGY,0.046813,percent,2019.0
14,Environment,"Energy imports, net ",C3_Cancel public events,Egypt,EGY,-7.391493975802161,percent of energy use,2014.0
16,Social issues ,Net migration,C3_Cancel public events,Egypt,EGY,-190164.0,net total / data are 5 year estimates,2019.0
17,Health,"Prevalence of overweight (modeled estimate, % of children under 5)",C3_Cancel public events,Egypt,EGY,17.8,percent,2020.0
18,Environment,Electricity production from coal sources ,C3_Cancel public events,Egypt,EGY,0.0,percent of total,2015.0
19,Demographics,Secure Internet servers ,C3_Cancel public events,Egypt,EGY,35.33288262242069,per 1 million people,2019.0
20,Health,Prevalence of Hypertensive heart disease,C3_Cancel public events,Egypt,EGY,0.00173,percent,2019.0
21,Health,Prevalence of Depressive disorders,C3_Cancel public events,Egypt,EGY,0.038731,percent,2019.0
22,Health,Domestic General Government Health Expenditure (GGHE-D) as % General Government Expenditure (GGE),C3_Cancel public events,Egypt,EGY,1.4,percent,2018.0
23,Economics,Volume of exports,C3_Cancel public events,Egypt,EGY,8.151,percent change,2020.0
24,Environment,Combustible renewables and waste,C3_Cancel public events,Egypt,EGY,2.288711,percent of total energy,2014.0
25,Health,"Prevalence of stunting, height for age (modeled estimate, % of children under 5)",C3_Cancel public events,Egypt,EGY,22.3,percent,2020.0
26,Health,Prevalence of down syndrome,C3_Cancel public events,Egypt,EGY,0.000399,percent,2019.0
28,Governance,Fragile States Index Total ,C3_Cancel public events,Egypt,EGY,86.00613825029183,score,2020.0
29,Environment,"PM2.5 air pollution, population exposed to levels exceeding WHO guideline value ",C3_Cancel public events,Egypt,EGY,100.0,percent of total,2017.0
30,Environment,"Electricity production from oil, gas and coal sources",C3_Cancel public events,Egypt,EGY,91.74071448589658,percent of total,2015.0
31,Economics,Employment in services (% of total employment) (modeled ILO estimate),C3_Cancel public events,Egypt,EGY,48.5509987,Percentage of total employment,2020.0
32,Demographics,Mobile cellular subscriptions,C3_Cancel public events,Egypt,EGY,94.9717,per 100 people,2019.0
33,Health,Prevalence of chronic kidney disease,C3_Cancel public events,Egypt,EGY,0.079929,percent,2019.0
34,Governance,Personal Freedom Score ,C3_Cancel public events,Egypt,EGY,3.95,score,2018.0
35,Environment,Electric power consumption ,C3_Cancel public events,Egypt,EGY,1683.213518295575,kWh per capita,2014.0
36,Environment,"Adjusted net savings, including particulate emission damage",C3_Cancel public events,Egypt,EGY,3.55627892719642,percent of GNI,2018.0
37,Health,"Nurses and midwives (per 1,000 people)",C3_Cancel public events,Egypt,EGY,1.9262,Ones,2018.0
38,Health,"Physicians (per 1,000 people)",C3_Cancel public events,Egypt,EGY,0.4521,Ones,2018.0
39,Health,"Prevalence of HIV, total (% of population ages 15-49)",C3_Cancel public events,Egypt,EGY,0.1,percent,2019.0
40,Governance,Voice and accountability estimate,C3_Cancel public events,Egypt,EGY,-1.428673,score,2019.0
41,Environment,"Electricity production from renewable sources, excluding hydroelectric",C3_Cancel public events,Egypt,EGY,1598000000.0,kWh,2015.0
42,Health,"Immunization, measles (% of children ages 12-23 months)",C3_Cancel public events,Egypt,EGY,95.0,percent,2019.0
43,Health,Summary exposure value tobacco,C3_Cancel public events,Egypt,EGY,35.65798,Rate (risk-weighted prevalence),2019.0
44,Environment,Electricity production from oil sources,C3_Cancel public events,Egypt,EGY,21.01199602147524,percent of total,2015.0
45,Environment,"PM2.5 air pollution, mean annual exposure",C3_Cancel public events,Egypt,EGY,86.99945,micrograms per cubic meter,2017.0
49,Governance,Aggregate score for the Political Rights category,C3_Cancel public events,Egypt,EGY,6.0,score,2021.0
50,Economics,Volume of imports,C3_Cancel public events,Egypt,EGY,3.623,percent change,2020.0
52,Governance,Human Development Index,C3_Cancel public events,Egypt,EGY,0.707,index,2019.0
53,Social issues ,Gini index (World Bank estimate),C3_Cancel public events,Egypt,EGY,31.5,index ,2017.0
54,Governance,Corruption Perceptions Index,C3_Cancel public events,Egypt,EGY,33.0,score,2020.0
55,Governance,Control of corruption estimate,C3_Cancel public events,Egypt,EGY,-0.670213,score,2019.0
58,Health,Prevalence of total cancers,C3_Cancel public events,Egypt,EGY,0.0042,percent,2019.0
59,Social issues ,Proportion of women in managerial positions (%),C3_Cancel public events,Egypt,EGY,6.37,percent,2017.0
60,Governance,Political stability and absence of violence/terrorism estimate,C3_Cancel public events,Egypt,EGY,-1.066421,score,2019.0
62,Governance,Regulatory quality estimate,C3_Cancel public events,Egypt,EGY,-0.827766,score,2019.0
64,Environment,CO2 emissions (kt),C3_Cancel public events,Egypt,EGY,238560.4,kt,2016.0
66,Economics,"Unemployment, total (% of total labor force) (modeled ILO estimate)",C3_Cancel public events,Egypt,EGY,10.1280003,percent of total labor force,2020.0
67,Economics,"Labor force participation rate, total (% of total population ages 15+) (modeled ILO estimate)",C3_Cancel public events,Egypt,EGY,46.4959984,Percentage of total population,2020.0
69,Social issues ,Proportion of seats held by women in national parliaments (%),C3_Cancel public events,Egypt,EGY,15.10067114,proportion,2020.0
70,Economics,"Labor force participation rate, female (% of female population ages 15+) (modeled ILO estimate)",C3_Cancel public events,Egypt,EGY,22.0760002,Percentage of females of the total population,2020.0
71,Governance,Aggregate score for the Civil Liberties category,C3_Cancel public events,Egypt,EGY,12.0,score,2021.0
74,Social issues ,Life Ladder ,C3_Cancel public events,Egypt,EGY,4.282700061798096,score,2021.0
75,Health,Mortality due to COVID-19,C3_Cancel public events,Egypt,EGY,7041.0,"Number (cumulative total by Dec 26,2020)",2020.0
76,Health,"Immunization, DPT (% of children ages 12-23 months)",C3_Cancel public events,Egypt,EGY,95.0,percent,2019.0
77,Environment,Energy use (kg of oil equivalent per capita),C3_Cancel public events,Egypt,EGY,827.4971668677881,kg of oil equivalent per capita,2014.0
78,Environment,Energy use ,C3_Cancel public events,Egypt,EGY,79.92308951008364,"(kg of oil equivalent) per $1,000 GDP (constant 2017 PPP)",2014.0
80,Health,Prevalence of obesity,C3_Cancel public events,Egypt,EGY,32.0,percent,2016.0
81,Social issues ,Press freedom score,C3_Cancel public events,Egypt,EGY,56.82,score,2020.0
83,Environment,CO2 emissions (metric tons per capita),C3_Cancel public events,Egypt,EGY,2.525863,metric tons per capita,2016.0
84,Environment,Access to electricity ,C3_Cancel public events,Egypt,EGY,100.0,percent of population,2018.0
85,Governance,Human Freedom Score ,C3_Cancel public events,Egypt,EGY,4.67,score,2018.0
91,Environment,Electricity production from nuclear sources ,C3_Cancel public events,Egypt,EGY,0.0,percent of total,2014.0
93,Governance,Total freedom in the world score ,C3_Cancel public events,Egypt,EGY,18.0,score,2021.0
