rank,Category,Indicator,Policy,Country,ISO,value,unit,year
1,Demographics,Individuals using the Internet,C8_International travel controls,Albania,ALB,69.6429,percent of population,2019.0
2,Governance,Corruption Perceptions Index,C8_International travel controls,Albania,ALB,36.0,score,2020.0
3,Health,Prevalence of COVID-19,C8_International travel controls,Albania,ALB,52004.0,"Number (cumulative total by Dec 26,2020)",2020.0
5,Demographics,Secure Internet servers ,C8_International travel controls,Albania,ALB,767.2927284824317,per 1 million people,2019.0
6,Health,Prevalence of down syndrome,C8_International travel controls,Albania,ALB,0.000151,percent,2019.0
7,Health,Prevalence of Hypertensive heart disease,C8_International travel controls,Albania,ALB,0.001544,percent,2019.0
8,Health,Mortality due to COVID-19,C8_International travel controls,Albania,ALB,1066.0,"Number (cumulative total by Dec 26,2020)",2020.0
9,Social issues ,Press freedom score,C8_International travel controls,Albania,ALB,30.25,score,2020.0
10,Health,Prevalence of anxiety disorders,C8_International travel controls,Albania,ALB,0.044595,percent,2019.0
11,Environment,"Energy imports, net ",C8_International travel controls,Albania,ALB,13.79797089796564,percent of energy use,2014.0
12,Health,Summary exposure value tobacco,C8_International travel controls,Albania,ALB,33.62786,Rate (risk-weighted prevalence),2019.0
13,Health,Prevalence of total cancers,C8_International travel controls,Albania,ALB,0.012352,percent,2019.0
14,Governance,Control of corruption estimate,C8_International travel controls,Albania,ALB,-0.5287576,score,2019.0
15,Demographics,Fixed broadband subscriptions,C8_International travel controls,Albania,ALB,15.1407,per 100 people,2019.0
16,Environment,"Adjusted net savings, including particulate emission damage",C8_International travel controls,Albania,ALB,-1.55487751567793,percent of GNI,2018.0
17,Health,"Incidence of tuberculosis (per 100,000 people)",C8_International travel controls,Albania,ALB,16.0,Cases,2019.0
19,Environment,"Electricity production from renewable sources, excluding hydroelectric",C8_International travel controls,Albania,ALB,0.0,kWh,2015.0
20,Social issues ,Proportion of women in managerial positions (%),C8_International travel controls,Albania,ALB,22.61,percent,2017.0
21,Social issues ,Net migration,C8_International travel controls,Albania,ALB,-69998.0,net total / data are 5 year estimates,2019.0
22,Governance,Government effectiveness estimate,C8_International travel controls,Albania,ALB,-0.0613309,score,2019.0
23,Economics,"Central government debt, total",C8_International travel controls,Albania,ALB,80.7355753879892,percent of GDP,2016.0
24,Health,Prevalence of obesity,C8_International travel controls,Albania,ALB,21.7,percent,2016.0
25,Health,"Immunization, measles (% of children ages 12-23 months)",C8_International travel controls,Albania,ALB,95.0,percent,2019.0
27,Governance,Aggregate score for the Civil Liberties category,C8_International travel controls,Albania,ALB,39.0,score,2021.0
28,Health,"Prevalence of stunting, height for age (modeled estimate, % of children under 5)",C8_International travel controls,Albania,ALB,9.6,percent,2020.0
29,Economics,Employment in services (% of total employment) (modeled ILO estimate),C8_International travel controls,Albania,ALB,43.6629982,Percentage of total employment,2020.0
30,Social issues ,Life Ladder ,C8_International travel controls,Albania,ALB,5.117400169372559,score,2021.0
31,Health,Domestic General Government Health Expenditure (GGHE-D) as % General Government Expenditure (GGE),C8_International travel controls,Albania,ALB,2.8,percent,2018.0
32,Environment,Renewable energy consumption ,C8_International travel controls,Albania,ALB,38.6152104692153,percent of total final energy consumption,2015.0
33,Health,"Physicians (per 1,000 people)",C8_International travel controls,Albania,ALB,1.2164,Ones,2016.0
34,Governance,Fragile States Index Total ,C8_International travel controls,Albania,ALB,58.75381081040027,score,2020.0
35,Governance,Aggregate score for the Political Rights category,C8_International travel controls,Albania,ALB,27.0,score,2021.0
36,Environment,Electricity production from coal sources ,C8_International travel controls,Albania,ALB,0.0,percent of total,2015.0
37,Environment,Energy use ,C8_International travel controls,Albania,ALB,68.34967572198514,"(kg of oil equivalent) per $1,000 GDP (constant 2017 PPP)",2014.0
38,Demographics,Mobile cellular subscriptions,C8_International travel controls,Albania,ALB,91.293,per 100 people,2019.0
41,Health,"Immunization, DPT (% of children ages 12-23 months)",C8_International travel controls,Albania,ALB,99.0,percent,2019.0
42,Health,Prevalence of Diabetes,C8_International travel controls,Albania,ALB,0.051966,percent,2019.0
43,Economics,"Labor force participation rate, female (% of female population ages 15+) (modeled ILO estimate)",C8_International travel controls,Albania,ALB,46.6030006,Percentage of females of the total population,2020.0
44,Environment,"PM2.5 air pollution, population exposed to levels exceeding WHO guideline value ",C8_International travel controls,Albania,ALB,99.9999999999643,percent of total,2017.0
45,Governance,Personal Freedom Score ,C8_International travel controls,Albania,ALB,7.81,score,2018.0
46,Health,"Prevalence of overweight (modeled estimate, % of children under 5)",C8_International travel controls,Albania,ALB,14.6,percent,2020.0
47,Environment,Electric power consumption ,C8_International travel controls,Albania,ALB,2309.36650255581,kWh per capita,2014.0
48,Environment,Fossil fuel energy consumption,C8_International travel controls,Albania,ALB,61.4218,percent of total,2014.0
49,Governance,Human Freedom Score ,C8_International travel controls,Albania,ALB,7.81,score,2018.0
50,Environment,CO2 emissions (metric tons per capita),C8_International travel controls,Albania,ALB,1.577163,metric tons per capita,2016.0
51,Social issues ,"Intentional homicides (per 100,000 people)",C8_International travel controls,Albania,ALB,2.2894924438,"proportion, pero 100,000 people",2018.0
52,Health,Prevalence of chronic kidney disease,C8_International travel controls,Albania,ALB,0.105404,percent,2019.0
55,Governance,Voice and accountability estimate,C8_International travel controls,Albania,ALB,0.1518047,score,2019.0
56,Economics,"Unemployment, total (% of total labor force) (modeled ILO estimate)",C8_International travel controls,Albania,ALB,12.8129997,percent of total labor force,2020.0
57,Governance,Regulatory quality estimate,C8_International travel controls,Albania,ALB,0.2743798,score,2019.0
58,Demographics,Fixed telephone subscriptions,C8_International travel controls,Albania,ALB,242859.0,number,2019.0
59,Governance,Rule of law estimate ,C8_International travel controls,Albania,ALB,-0.4111794,score,2019.0
60,Governance,Political stability and absence of violence/terrorism estimate,C8_International travel controls,Albania,ALB,0.1185695,score,2019.0
63,Governance,Serious assault (rate),C8_International travel controls,Albania,ALB,4.68,rate,2018.0
64,Social issues ,Gini index (World Bank estimate),C8_International travel controls,Albania,ALB,33.2,index ,2017.0
66,Environment,Electricity production from oil sources,C8_International travel controls,Albania,ALB,0.0,percent of total,2015.0
68,Health,Prevalence of Depressive disorders,C8_International travel controls,Albania,ALB,0.030548,percent,2019.0
69,Environment,"PM2.5 air pollution, mean annual exposure",C8_International travel controls,Albania,ALB,18.2006,micrograms per cubic meter,2017.0
70,Economics,Volume of imports,C8_International travel controls,Albania,ALB,4.832,percent change,2020.0
71,Governance,Human Development Index,C8_International travel controls,Albania,ALB,0.795,index,2019.0
73,Governance,Economic Freedom Score,C8_International travel controls,Albania,ALB,7.8,score,2018.0
74,Environment,Combustible renewables and waste,C8_International travel controls,Albania,ALB,9.361381,percent of total energy,2014.0
75,Economics,"Labor force participation rate, total (% of total population ages 15+) (modeled ILO estimate)",C8_International travel controls,Albania,ALB,55.5909996,Percentage of total population,2020.0
76,Health,"Nurses and midwives (per 1,000 people)",C8_International travel controls,Albania,ALB,3.6495,Ones,2016.0
78,Governance,Total freedom in the world score ,C8_International travel controls,Albania,ALB,66.0,score,2021.0
79,Health,"Prevalence of HIV, total (% of population ages 15-49)",C8_International travel controls,Albania,ALB,0.1,percent,2019.0
80,Environment,Access to electricity ,C8_International travel controls,Albania,ALB,100.0,percent of population,2018.0
81,Environment,Energy use (kg of oil equivalent per capita),C8_International travel controls,Albania,ALB,808.455839595944,kg of oil equivalent per capita,2014.0
82,Economics,Volume of exports,C8_International travel controls,Albania,ALB,5.842,percent change,2020.0
86,Environment,CO2 emissions (kt),C8_International travel controls,Albania,ALB,4536.079,kt,2016.0
89,Health,Prevalence of Respiratory infections and tuberculosis,C8_International travel controls,Albania,ALB,0.207619,percent,2019.0
91,Environment,"Electricity production from oil, gas and coal sources",C8_International travel controls,Albania,ALB,0.0,percent of total,2015.0
99,Environment,Electricity production from nuclear sources ,C8_International travel controls,Albania,ALB,0.0,percent of total,2014.0
