rank,Category,Indicator,Policy,Country,ISO,value,unit,year
1,Demographics,Individuals using the Internet,H1_Public information campaigns,Djibouti,DJI,55.6814,percent of population,2019.0
2,Governance,Corruption Perceptions Index,H1_Public information campaigns,Djibouti,DJI,27.0,score,2020.0
3,Demographics,Secure Internet servers ,H1_Public information campaigns,Djibouti,DJI,45.19495459961379,per 1 million people,2019.0
4,Health,Prevalence of COVID-19,H1_Public information campaigns,Djibouti,DJI,5780.0,"Number (cumulative total by Dec 26,2020)",2020.0
6,Health,Mortality due to COVID-19,H1_Public information campaigns,Djibouti,DJI,61.0,"Number (cumulative total by Dec 26,2020)",2020.0
7,Health,Summary exposure value tobacco,H1_Public information campaigns,Djibouti,DJI,23.46939,Rate (risk-weighted prevalence),2019.0
8,Social issues ,Net migration,H1_Public information campaigns,Djibouti,DJI,4501.0,net total / data are 5 year estimates,2019.0
9,Health,"Physicians (per 1,000 people)",H1_Public information campaigns,Djibouti,DJI,0.2237,Ones,2014.0
10,Demographics,Mobile cellular subscriptions,H1_Public information campaigns,Djibouti,DJI,41.1959,per 100 people,2019.0
11,Health,"Prevalence of overweight (modeled estimate, % of children under 5)",H1_Public information campaigns,Djibouti,DJI,7.2,percent,2020.0
13,Demographics,Fixed broadband subscriptions,H1_Public information campaigns,Djibouti,DJI,2.66007,per 100 people,2019.0
14,Economics,Volume of imports,H1_Public information campaigns,Djibouti,DJI,5.511,percent change,2020.0
17,Health,"Immunization, measles (% of children ages 12-23 months)",H1_Public information campaigns,Djibouti,DJI,83.0,percent,2019.0
18,Health,Prevalence of anxiety disorders,H1_Public information campaigns,Djibouti,DJI,0.032784,percent,2019.0
20,Economics,"Labor force participation rate, female (% of female population ages 15+) (modeled ILO estimate)",H1_Public information campaigns,Djibouti,DJI,50.7799988,Percentage of females of the total population,2020.0
21,Environment,CO2 emissions (kt),H1_Public information campaigns,Djibouti,DJI,619.723,kt,2016.0
22,Health,"Incidence of tuberculosis (per 100,000 people)",H1_Public information campaigns,Djibouti,DJI,234.0,Cases,2019.0
23,Environment,Renewable energy consumption ,H1_Public information campaigns,Djibouti,DJI,15.3805952215024,percent of total final energy consumption,2015.0
24,Governance,Aggregate score for the Political Rights category,H1_Public information campaigns,Djibouti,DJI,5.0,score,2021.0
25,Health,"Nurses and midwives (per 1,000 people)",H1_Public information campaigns,Djibouti,DJI,0.7288,Ones,2014.0
26,Health,"Prevalence of HIV, total (% of population ages 15-49)",H1_Public information campaigns,Djibouti,DJI,0.8,percent,2019.0
27,Environment,"Adjusted net savings, including particulate emission damage",H1_Public information campaigns,Djibouti,DJI,40.8492668945346,percent of GNI,2018.0
28,Economics,Employment in services (% of total employment) (modeled ILO estimate),H1_Public information campaigns,Djibouti,DJI,54.3419991,Percentage of total employment,2020.0
29,Environment,"PM2.5 air pollution, mean annual exposure",H1_Public information campaigns,Djibouti,DJI,45.54962,micrograms per cubic meter,2017.0
32,Environment,Access to electricity ,H1_Public information campaigns,Djibouti,DJI,60.3954467773438,percent of population,2018.0
34,Health,Prevalence of down syndrome,H1_Public information campaigns,Djibouti,DJI,0.000147,percent,2019.0
38,Governance,Regulatory quality estimate,H1_Public information campaigns,Djibouti,DJI,-0.7717019,score,2019.0
39,Health,"Immunization, DPT (% of children ages 12-23 months)",H1_Public information campaigns,Djibouti,DJI,85.0,percent,2019.0
40,Health,Prevalence of Respiratory infections and tuberculosis,H1_Public information campaigns,Djibouti,DJI,0.227321,percent,2019.0
43,Environment,"PM2.5 air pollution, population exposed to levels exceeding WHO guideline value ",H1_Public information campaigns,Djibouti,DJI,100.0,percent of total,2017.0
45,Social issues ,Press freedom score,H1_Public information campaigns,Djibouti,DJI,76.73,score,2020.0
46,Social issues ,Proportion of seats held by women in national parliaments (%),H1_Public information campaigns,Djibouti,DJI,26.15384615,proportion,2020.0
47,Governance,Aggregate score for the Civil Liberties category,H1_Public information campaigns,Djibouti,DJI,19.0,score,2021.0
48,Health,Prevalence of Hypertensive heart disease,H1_Public information campaigns,Djibouti,DJI,0.001395,percent,2019.0
49,Economics,"Unemployment, total (% of total labor force) (modeled ILO estimate)",H1_Public information campaigns,Djibouti,DJI,10.323,percent of total labor force,2020.0
50,Health,Prevalence of Depressive disorders,H1_Public information campaigns,Djibouti,DJI,0.040094,percent,2019.0
51,Governance,Human Development Index,H1_Public information campaigns,Djibouti,DJI,0.524,index,2019.0
52,Governance,Total freedom in the world score ,H1_Public information campaigns,Djibouti,DJI,24.0,score,2021.0
53,Health,Prevalence of obesity,H1_Public information campaigns,Djibouti,DJI,13.5,percent,2016.0
55,Governance,Political stability and absence of violence/terrorism estimate,H1_Public information campaigns,Djibouti,DJI,-0.3445927,score,2019.0
56,Health,"Prevalence of stunting, height for age (modeled estimate, % of children under 5)",H1_Public information campaigns,Djibouti,DJI,34.0,percent,2020.0
59,Health,Prevalence of total cancers,H1_Public information campaigns,Djibouti,DJI,0.003174,percent,2019.0
63,Demographics,Fixed telephone subscriptions,H1_Public information campaigns,Djibouti,DJI,36855.0,number,2019.0
64,Economics,Volume of exports,H1_Public information campaigns,Djibouti,DJI,3.999,percent change,2020.0
65,Governance,Fragile States Index Total ,H1_Public information campaigns,Djibouti,DJI,82.72548312161723,score,2020.0
68,Health,Prevalence of Diabetes,H1_Public information campaigns,Djibouti,DJI,0.023558,percent,2019.0
69,Governance,Control of corruption estimate,H1_Public information campaigns,Djibouti,DJI,-0.8556599,score,2019.0
71,Governance,Voice and accountability estimate,H1_Public information campaigns,Djibouti,DJI,-1.406525,score,2019.0
72,Governance,Rule of law estimate ,H1_Public information campaigns,Djibouti,DJI,-0.9144034,score,2019.0
73,Environment,CO2 emissions (metric tons per capita),H1_Public information campaigns,Djibouti,DJI,0.667006,metric tons per capita,2016.0
78,Health,Prevalence of chronic kidney disease,H1_Public information campaigns,Djibouti,DJI,0.044811,percent,2019.0
79,Social issues ,Gini index (World Bank estimate),H1_Public information campaigns,Djibouti,DJI,41.6,index ,2017.0
93,Governance,"CPIA transparency, accountability, and corruption in the public sector rating (1=low to 6=high)",H1_Public information campaigns,Djibouti,DJI,2.5,rating,2019.0
94,Governance,Government effectiveness estimate,H1_Public information campaigns,Djibouti,DJI,-0.7133427,score,2019.0
105,Economics,"Labor force participation rate, total (% of total population ages 15+) (modeled ILO estimate)",H1_Public information campaigns,Djibouti,DJI,60.2659988,Percentage of total population,2020.0
109,Health,Domestic General Government Health Expenditure (GGHE-D) as % General Government Expenditure (GGE),H1_Public information campaigns,Djibouti,DJI,1.2,percent,2018.0
