rank,Category,Indicator,Policy,Country,ISO,value,unit,year
1,Demographics,Individuals using the Internet,E2_Debt/contract relief,Czech Republic,CZE,80.8669,percent of population,2019.0
2,Governance,Corruption Perceptions Index,E2_Debt/contract relief,Czech Republic,CZE,54.0,score,2020.0
3,Health,Prevalence of COVID-19,E2_Debt/contract relief,Czech Republic,CZE,618836.0,"Number (cumulative total by Dec 26,2020)",2020.0
5,Environment,Fossil fuel energy consumption,E2_Debt/contract relief,Czech Republic,CZE,77.73459,percent of total,2015.0
6,Demographics,Secure Internet servers ,E2_Debt/contract relief,Czech Republic,CZE,56198.25245468269,per 1 million people,2019.0
7,Social issues ,Life Ladder ,E2_Debt/contract relief,Czech Republic,CZE,6.964700222015381,score,2021.0
8,Health,"Incidence of tuberculosis (per 100,000 people)",E2_Debt/contract relief,Czech Republic,CZE,4.9,Cases,2019.0
9,Health,Summary exposure value tobacco,E2_Debt/contract relief,Czech Republic,CZE,27.67085,Rate (risk-weighted prevalence),2019.0
10,Demographics,Fixed broadband subscriptions,E2_Debt/contract relief,Czech Republic,CZE,33.5366,per 100 people,2019.0
11,Health,"Immunization, measles (% of children ages 12-23 months)",E2_Debt/contract relief,Czech Republic,CZE,92.0,percent,2019.0
12,Environment,"PM2.5 air pollution, population exposed to levels exceeding WHO guideline value ",E2_Debt/contract relief,Czech Republic,CZE,99.6772126159304,percent of total,2017.0
13,Health,Mortality due to COVID-19,E2_Debt/contract relief,Czech Republic,CZE,10271.0,"Number (cumulative total by Dec 26,2020)",2020.0
14,Health,Domestic General Government Health Expenditure (GGHE-D) as % General Government Expenditure (GGE),E2_Debt/contract relief,Czech Republic,CZE,6.3,percent,2018.0
15,Social issues ,Press freedom score,E2_Debt/contract relief,Czech Republic,CZE,23.57,score,2020.0
16,Economics,Employment in services (% of total employment) (modeled ILO estimate),E2_Debt/contract relief,Czech Republic,CZE,60.2360001,Percentage of total employment,2020.0
17,Environment,CO2 emissions (kt),E2_Debt/contract relief,Czech Republic,CZE,102217.6,kt,2016.0
18,Governance,Control of corruption estimate,E2_Debt/contract relief,Czech Republic,CZE,0.5062277,score,2019.0
19,Health,Prevalence of Respiratory infections and tuberculosis,E2_Debt/contract relief,Czech Republic,CZE,0.179753,percent,2019.0
20,Social issues ,Net migration,E2_Debt/contract relief,Czech Republic,CZE,110057.0,net total / data are 5 year estimates,2019.0
21,Health,Prevalence of anxiety disorders,E2_Debt/contract relief,Czech Republic,CZE,0.037042,percent,2019.0
22,Governance,Economic Freedom Score,E2_Debt/contract relief,Czech Republic,CZE,7.81,score,2018.0
23,Health,Prevalence of Diabetes,E2_Debt/contract relief,Czech Republic,CZE,0.164171,percent,2019.0
24,Governance,Aggregate score for the Political Rights category,E2_Debt/contract relief,Czech Republic,CZE,36.0,score,2021.0
26,Health,Prevalence of Hypertensive heart disease,E2_Debt/contract relief,Czech Republic,CZE,0.002634,percent,2019.0
27,Economics,Volume of exports,E2_Debt/contract relief,Czech Republic,CZE,4.0,percent change,2020.0
28,Economics,"Labor force participation rate, female (% of female population ages 15+) (modeled ILO estimate)",E2_Debt/contract relief,Czech Republic,CZE,52.8160019,Percentage of females of the total population,2020.0
29,Environment,"Adjusted net savings, including particulate emission damage",E2_Debt/contract relief,Czech Republic,CZE,10.1819502482122,percent of GNI,2017.0
30,Health,"Physicians (per 1,000 people)",E2_Debt/contract relief,Czech Republic,CZE,4.1208,Ones,2018.0
31,Governance,Personal Freedom Score ,E2_Debt/contract relief,Czech Republic,CZE,8.76,score,2018.0
32,Governance,Human Development Index,E2_Debt/contract relief,Czech Republic,CZE,0.9,index,2019.0
33,Environment,Renewable energy consumption ,E2_Debt/contract relief,Czech Republic,CZE,14.8285619496241,percent of total final energy consumption,2015.0
35,Health,"Prevalence of overweight (modeled estimate, % of children under 5)",E2_Debt/contract relief,Czech Republic,CZE,6.6,percent,2020.0
36,Governance,Political stability and absence of violence/terrorism estimate,E2_Debt/contract relief,Czech Republic,CZE,0.952085,score,2019.0
38,Governance,Voice and accountability estimate,E2_Debt/contract relief,Czech Republic,CZE,0.9368531,score,2019.0
39,Social issues ,"Intentional homicides (per 100,000 people)",E2_Debt/contract relief,Czech Republic,CZE,0.62024059321,"proportion, pero 100,000 people",2017.0
40,Environment,Combustible renewables and waste,E2_Debt/contract relief,Czech Republic,CZE,6.81918,percent of total energy,2015.0
41,Environment,"Electricity production from renewable sources, excluding hydroelectric",E2_Debt/contract relief,Czech Republic,CZE,7627000000.0,kWh,2015.0
42,Social issues ,Proportion of women in managerial positions (%),E2_Debt/contract relief,Czech Republic,CZE,26.76,percent,2018.0
43,Environment,"PM2.5 air pollution, mean annual exposure",E2_Debt/contract relief,Czech Republic,CZE,16.07125,micrograms per cubic meter,2017.0
44,Environment,"Energy imports, net ",E2_Debt/contract relief,Czech Republic,CZE,31.62369863145948,percent of energy use,2015.0
45,Health,Prevalence of chronic kidney disease,E2_Debt/contract relief,Czech Republic,CZE,0.128147,percent,2019.0
46,Governance,Aggregate score for the Civil Liberties category,E2_Debt/contract relief,Czech Republic,CZE,55.0,score,2021.0
47,Environment,Electricity production from oil sources,E2_Debt/contract relief,Czech Republic,CZE,0.1137794131887286,percent of total,2015.0
48,Social issues ,Gini index (World Bank estimate),E2_Debt/contract relief,Czech Republic,CZE,24.9,index ,2017.0
49,Environment,Energy use (kg of oil equivalent per capita),E2_Debt/contract relief,Czech Republic,CZE,3860.002964140444,kg of oil equivalent per capita,2015.0
50,Health,Prevalence of Depressive disorders,E2_Debt/contract relief,Czech Republic,CZE,0.038372,percent,2019.0
51,Demographics,Mobile cellular subscriptions,E2_Debt/contract relief,Czech Republic,CZE,123.536,per 100 people,2019.0
52,Governance,Government effectiveness estimate,E2_Debt/contract relief,Czech Republic,CZE,0.8856382,score,2019.0
53,Governance,Rule of law estimate ,E2_Debt/contract relief,Czech Republic,CZE,1.046504,score,2019.0
54,Environment,CO2 emissions (metric tons per capita),E2_Debt/contract relief,Czech Republic,CZE,9.673899,metric tons per capita,2016.0
55,Health,Prevalence of total cancers,E2_Debt/contract relief,Czech Republic,CZE,0.030152,percent,2019.0
56,Health,Prevalence of down syndrome,E2_Debt/contract relief,Czech Republic,CZE,0.000123,percent,2019.0
57,Environment,Electric power consumption ,E2_Debt/contract relief,Czech Republic,CZE,6258.891037036594,kWh per capita,2014.0
59,Governance,Total freedom in the world score ,E2_Debt/contract relief,Czech Republic,CZE,91.0,score,2021.0
61,Economics,"Unemployment, total (% of total labor force) (modeled ILO estimate)",E2_Debt/contract relief,Czech Republic,CZE,1.90999997,percent of total labor force,2020.0
63,Social issues ,Proportion of seats held by women in national parliaments (%),E2_Debt/contract relief,Czech Republic,CZE,22.5,proportion,2020.0
65,Health,"Immunization, DPT (% of children ages 12-23 months)",E2_Debt/contract relief,Czech Republic,CZE,97.0,percent,2019.0
66,Demographics,Fixed telephone subscriptions,E2_Debt/contract relief,Czech Republic,CZE,1473000.0,number,2019.0
68,Environment,Electricity production from coal sources ,E2_Debt/contract relief,Czech Republic,CZE,53.06115038249249,percent of total,2015.0
69,Environment,"Electricity production from oil, gas and coal sources",E2_Debt/contract relief,Czech Republic,CZE,55.91531906652465,percent of total,2015.0
71,Economics,Volume of imports,E2_Debt/contract relief,Czech Republic,CZE,4.7,percent change,2020.0
73,Health,"Prevalence of stunting, height for age (modeled estimate, % of children under 5)",E2_Debt/contract relief,Czech Republic,CZE,2.5,percent,2020.0
74,Governance,Regulatory quality estimate,E2_Debt/contract relief,Czech Republic,CZE,1.245128,score,2019.0
80,Governance,Fragile States Index Total ,E2_Debt/contract relief,Czech Republic,CZE,37.6,score,2019.0
82,Economics,"Labor force participation rate, total (% of total population ages 15+) (modeled ILO estimate)",E2_Debt/contract relief,Czech Republic,CZE,60.3320007,Percentage of total population,2020.0
85,Environment,Energy use ,E2_Debt/contract relief,Czech Republic,CZE,106.3159289322501,"(kg of oil equivalent) per $1,000 GDP (constant 2017 PPP)",2015.0
86,Governance,Human Freedom Score ,E2_Debt/contract relief,Czech Republic,CZE,8.29,score,2018.0
89,Governance,Serious assault (rate),E2_Debt/contract relief,Czech Republic,CZE,46.57,rate,2018.0
98,Health,Prevalence of obesity,E2_Debt/contract relief,Czech Republic,CZE,26.0,percent,2016.0
106,Health,"Nurses and midwives (per 1,000 people)",E2_Debt/contract relief,Czech Republic,CZE,8.3955,Ones,2017.0
115,Environment,Electricity production from nuclear sources ,E2_Debt/contract relief,Czech Republic,CZE,32.48886414253897,percent of total,2015.0
117,Environment,Access to electricity ,E2_Debt/contract relief,Czech Republic,CZE,100.0,percent of population,2018.0
