rank,Category,Indicator,Policy,Country,ISO,value,unit,year
1,Demographics,Individuals using the Internet,E2_Debt/contract relief,Micronesia,FSM,35.3041,percent of population,2019.0
3,Health,Prevalence of COVID-19,E2_Debt/contract relief,Micronesia,FSM,0.0,"Number (cumulative total by Dec 26,2020)",2020.0
6,Demographics,Secure Internet servers ,E2_Debt/contract relief,Micronesia,FSM,210.8685146948996,per 1 million people,2019.0
8,Health,"Incidence of tuberculosis (per 100,000 people)",E2_Debt/contract relief,Micronesia,FSM,100.0,Cases,2019.0
9,Health,Summary exposure value tobacco,E2_Debt/contract relief,Micronesia,FSM,25.30581,Rate (risk-weighted prevalence),2019.0
10,Demographics,Fixed broadband subscriptions,E2_Debt/contract relief,Micronesia,FSM,3.38779,per 100 people,2019.0
11,Health,"Immunization, measles (% of children ages 12-23 months)",E2_Debt/contract relief,Micronesia,FSM,78.0,percent,2019.0
12,Environment,"PM2.5 air pollution, population exposed to levels exceeding WHO guideline value ",E2_Debt/contract relief,Micronesia,FSM,99.9999999837514,percent of total,2017.0
13,Health,Mortality due to COVID-19,E2_Debt/contract relief,Micronesia,FSM,0.0,"Number (cumulative total by Dec 26,2020)",2020.0
14,Health,Domestic General Government Health Expenditure (GGHE-D) as % General Government Expenditure (GGE),E2_Debt/contract relief,Micronesia,FSM,3.3,percent,2018.0
17,Environment,CO2 emissions (kt),E2_Debt/contract relief,Micronesia,FSM,143.013,kt,2016.0
18,Governance,Control of corruption estimate,E2_Debt/contract relief,Micronesia,FSM,0.7497162,score,2019.0
19,Health,Prevalence of Respiratory infections and tuberculosis,E2_Debt/contract relief,Micronesia,FSM,0.414042,percent,2019.0
20,Social issues ,Net migration,E2_Debt/contract relief,Micronesia,FSM,-2999.0,net total / data are 5 year estimates,2019.0
21,Health,Prevalence of anxiety disorders,E2_Debt/contract relief,Micronesia,FSM,0.041918,percent,2019.0
23,Health,Prevalence of Diabetes,E2_Debt/contract relief,Micronesia,FSM,0.105494,percent,2019.0
24,Governance,Aggregate score for the Political Rights category,E2_Debt/contract relief,Micronesia,FSM,37.0,score,2021.0
25,Economics,"Central government debt, total",E2_Debt/contract relief,Micronesia,FSM,25.39177741153753,percent of GDP,2016.0
26,Health,Prevalence of Hypertensive heart disease,E2_Debt/contract relief,Micronesia,FSM,0.001935,percent,2019.0
32,Governance,Human Development Index,E2_Debt/contract relief,Micronesia,FSM,0.62,index,2019.0
33,Environment,Renewable energy consumption ,E2_Debt/contract relief,Micronesia,FSM,1.19623786232284,percent of total final energy consumption,2015.0
34,Demographics,Age dependency ratio (% of working-age population),E2_Debt/contract relief,Micronesia,FSM,55.39581114660987,proportion,2019.0
36,Governance,Political stability and absence of violence/terrorism estimate,E2_Debt/contract relief,Micronesia,FSM,0.9964124,score,2019.0
38,Governance,Voice and accountability estimate,E2_Debt/contract relief,Micronesia,FSM,1.094265,score,2019.0
42,Social issues ,Proportion of women in managerial positions (%),E2_Debt/contract relief,Micronesia,FSM,20.26,percent,2014.0
43,Environment,"PM2.5 air pollution, mean annual exposure",E2_Debt/contract relief,Micronesia,FSM,11.2834,micrograms per cubic meter,2017.0
45,Health,Prevalence of chronic kidney disease,E2_Debt/contract relief,Micronesia,FSM,0.096116,percent,2019.0
46,Governance,Aggregate score for the Civil Liberties category,E2_Debt/contract relief,Micronesia,FSM,55.0,score,2021.0
50,Health,Prevalence of Depressive disorders,E2_Debt/contract relief,Micronesia,FSM,0.028717,percent,2019.0
51,Demographics,Mobile cellular subscriptions,E2_Debt/contract relief,Micronesia,FSM,20.7377,per 100 people,2019.0
52,Governance,Government effectiveness estimate,E2_Debt/contract relief,Micronesia,FSM,-0.1870816,score,2019.0
53,Governance,Rule of law estimate ,E2_Debt/contract relief,Micronesia,FSM,0.0241157,score,2019.0
54,Environment,CO2 emissions (metric tons per capita),E2_Debt/contract relief,Micronesia,FSM,1.297582,metric tons per capita,2016.0
55,Health,Prevalence of total cancers,E2_Debt/contract relief,Micronesia,FSM,0.006194,percent,2019.0
56,Health,Prevalence of down syndrome,E2_Debt/contract relief,Micronesia,FSM,0.00017,percent,2019.0
59,Governance,Total freedom in the world score ,E2_Debt/contract relief,Micronesia,FSM,92.0,score,2021.0
60,Economics,Unemployment rate (%) - Annual,E2_Debt/contract relief,Micronesia,FSM,9.1,percent,2014.0
63,Social issues ,Proportion of seats held by women in national parliaments (%),E2_Debt/contract relief,Micronesia,FSM,0.0,proportion,2020.0
65,Health,"Immunization, DPT (% of children ages 12-23 months)",E2_Debt/contract relief,Micronesia,FSM,78.0,percent,2019.0
66,Demographics,Fixed telephone subscriptions,E2_Debt/contract relief,Micronesia,FSM,6947.0,number,2019.0
70,Demographics,Urban population (% of total population),E2_Debt/contract relief,Micronesia,FSM,22.812,total,2019.0
74,Governance,Regulatory quality estimate,E2_Debt/contract relief,Micronesia,FSM,-0.9603013,score,2019.0
76,Demographics,People using at least basic sanitation services (% of population),E2_Debt/contract relief,Micronesia,FSM,88.3093315478836,proportion,2017.0
77,Demographics,Rural population (% of total population),E2_Debt/contract relief,Micronesia,FSM,77.188,proportion,2019.0
78,Demographics,Refugee population by country or territory of asylum,E2_Debt/contract relief,Micronesia,FSM,5.0,proportion,2016.0
80,Governance,Fragile States Index Total ,E2_Debt/contract relief,Micronesia,FSM,71.23563007855653,score,2020.0
81,Economics,"International tourism, receipts",E2_Debt/contract relief,Micronesia,FSM,25000000.0,US Dollar,2015.0
83,Governance,"CPIA transparency, accountability, and corruption in the public sector rating (1=low to 6=high)",E2_Debt/contract relief,Micronesia,FSM,3.5,rating,2019.0
84,Social issues ,"Primary completion rate, total (% of relevant age group)",E2_Debt/contract relief,Micronesia,FSM,88.4534301757813,proportion,2019.0
88,Demographics,"Age dependency ratio, old (% of working-age population)",E2_Debt/contract relief,Micronesia,FSM,6.515387346058272,proportion,2019.0
92,Economics,"Trade, total as % of GDP",E2_Debt/contract relief,Micronesia,FSM,60.89328,percent,2018.0
98,Health,Prevalence of obesity,E2_Debt/contract relief,Micronesia,FSM,45.8,percent,2016.0
100,Economics,"Foreign direct investment, net",E2_Debt/contract relief,Micronesia,FSM,800000.0,US Dollar,2015.0
101,Economics,"Lending interest rates, percent per annum",E2_Debt/contract relief,Micronesia,FSM,15.7,percent per annum,2018.0
106,Health,"Nurses and midwives (per 1,000 people)",E2_Debt/contract relief,Micronesia,FSM,2.0426,Ones,2018.0
110,Demographics,"Population, total",E2_Debt/contract relief,Micronesia,FSM,113815.0,total,2019.0
117,Environment,Access to electricity ,E2_Debt/contract relief,Micronesia,FSM,82.099723815918,percent of population,2018.0
