rank,Category,Indicator,Policy,Country,ISO,value,unit,year
1,Demographics,Individuals using the Internet,E2_Debt/contract relief,Croatia,HRV,79.0798,percent of population,2019.0
2,Governance,Corruption Perceptions Index,E2_Debt/contract relief,Croatia,HRV,47.0,score,2020.0
3,Health,Prevalence of COVID-19,E2_Debt/contract relief,Croatia,HRV,190235.0,"Number (cumulative total by Dec 26,2020)",2020.0
5,Environment,Fossil fuel energy consumption,E2_Debt/contract relief,Croatia,HRV,70.70366,percent of total,2014.0
6,Demographics,Secure Internet servers ,E2_Debt/contract relief,Croatia,HRV,22742.96250768285,per 1 million people,2019.0
7,Social issues ,Life Ladder ,E2_Debt/contract relief,Croatia,HRV,5.881700038909912,score,2021.0
8,Health,"Incidence of tuberculosis (per 100,000 people)",E2_Debt/contract relief,Croatia,HRV,8.0,Cases,2019.0
9,Health,Summary exposure value tobacco,E2_Debt/contract relief,Croatia,HRV,32.92863,Rate (risk-weighted prevalence),2019.0
10,Demographics,Fixed broadband subscriptions,E2_Debt/contract relief,Croatia,HRV,27.9585,per 100 people,2019.0
11,Health,"Immunization, measles (% of children ages 12-23 months)",E2_Debt/contract relief,Croatia,HRV,93.0,percent,2019.0
12,Environment,"PM2.5 air pollution, population exposed to levels exceeding WHO guideline value ",E2_Debt/contract relief,Croatia,HRV,99.7796052732656,percent of total,2017.0
13,Health,Mortality due to COVID-19,E2_Debt/contract relief,Croatia,HRV,3023.0,"Number (cumulative total by Dec 26,2020)",2020.0
14,Health,Domestic General Government Health Expenditure (GGHE-D) as % General Government Expenditure (GGE),E2_Debt/contract relief,Croatia,HRV,5.7,percent,2018.0
15,Social issues ,Press freedom score,E2_Debt/contract relief,Croatia,HRV,28.51,score,2020.0
16,Economics,Employment in services (% of total employment) (modeled ILO estimate),E2_Debt/contract relief,Croatia,HRV,66.7750015,Percentage of total employment,2020.0
17,Environment,CO2 emissions (kt),E2_Debt/contract relief,Croatia,HRV,17487.92,kt,2016.0
18,Governance,Control of corruption estimate,E2_Debt/contract relief,Croatia,HRV,0.1255409,score,2019.0
19,Health,Prevalence of Respiratory infections and tuberculosis,E2_Debt/contract relief,Croatia,HRV,0.177546,percent,2019.0
20,Social issues ,Net migration,E2_Debt/contract relief,Croatia,HRV,-40004.0,net total / data are 5 year estimates,2019.0
21,Health,Prevalence of anxiety disorders,E2_Debt/contract relief,Croatia,HRV,0.042878,percent,2019.0
22,Governance,Economic Freedom Score,E2_Debt/contract relief,Croatia,HRV,7.36,score,2018.0
23,Health,Prevalence of Diabetes,E2_Debt/contract relief,Croatia,HRV,0.111561,percent,2019.0
24,Governance,Aggregate score for the Political Rights category,E2_Debt/contract relief,Croatia,HRV,36.0,score,2021.0
26,Health,Prevalence of Hypertensive heart disease,E2_Debt/contract relief,Croatia,HRV,0.002651,percent,2019.0
27,Economics,Volume of exports,E2_Debt/contract relief,Croatia,HRV,5.145,percent change,2020.0
28,Economics,"Labor force participation rate, female (% of female population ages 15+) (modeled ILO estimate)",E2_Debt/contract relief,Croatia,HRV,45.3310013,Percentage of females of the total population,2020.0
29,Environment,"Adjusted net savings, including particulate emission damage",E2_Debt/contract relief,Croatia,HRV,14.4461735801751,percent of GNI,2018.0
30,Health,"Physicians (per 1,000 people)",E2_Debt/contract relief,Croatia,HRV,2.9996,Ones,2016.0
31,Governance,Personal Freedom Score ,E2_Debt/contract relief,Croatia,HRV,8.47,score,2018.0
32,Governance,Human Development Index,E2_Debt/contract relief,Croatia,HRV,0.851,index,2019.0
33,Environment,Renewable energy consumption ,E2_Debt/contract relief,Croatia,HRV,33.1274666358571,percent of total final energy consumption,2015.0
36,Governance,Political stability and absence of violence/terrorism estimate,E2_Debt/contract relief,Croatia,HRV,0.7554738,score,2019.0
37,Health,"Prevalence of HIV, total (% of population ages 15-49)",E2_Debt/contract relief,Croatia,HRV,0.1,percent,2019.0
38,Governance,Voice and accountability estimate,E2_Debt/contract relief,Croatia,HRV,0.5347807,score,2019.0
39,Social issues ,"Intentional homicides (per 100,000 people)",E2_Debt/contract relief,Croatia,HRV,0.57742179724,"proportion, pero 100,000 people",2018.0
40,Environment,Combustible renewables and waste,E2_Debt/contract relief,Croatia,HRV,13.60565,percent of total energy,2014.0
41,Environment,"Electricity production from renewable sources, excluding hydroelectric",E2_Debt/contract relief,Croatia,HRV,1119000000.0,kWh,2015.0
42,Social issues ,Proportion of women in managerial positions (%),E2_Debt/contract relief,Croatia,HRV,29.98,percent,2018.0
43,Environment,"PM2.5 air pollution, mean annual exposure",E2_Debt/contract relief,Croatia,HRV,17.90177,micrograms per cubic meter,2017.0
44,Environment,"Energy imports, net ",E2_Debt/contract relief,Croatia,HRV,45.85969270444382,percent of energy use,2014.0
45,Health,Prevalence of chronic kidney disease,E2_Debt/contract relief,Croatia,HRV,0.142291,percent,2019.0
46,Governance,Aggregate score for the Civil Liberties category,E2_Debt/contract relief,Croatia,HRV,49.0,score,2021.0
47,Environment,Electricity production from oil sources,E2_Debt/contract relief,Croatia,HRV,1.96654208933974,percent of total,2015.0
48,Social issues ,Gini index (World Bank estimate),E2_Debt/contract relief,Croatia,HRV,30.4,index ,2017.0
49,Environment,Energy use (kg of oil equivalent per capita),E2_Debt/contract relief,Croatia,HRV,1897.840665403766,kg of oil equivalent per capita,2014.0
50,Health,Prevalence of Depressive disorders,E2_Debt/contract relief,Croatia,HRV,0.041346,percent,2019.0
51,Demographics,Mobile cellular subscriptions,E2_Debt/contract relief,Croatia,HRV,106.642,per 100 people,2019.0
52,Governance,Government effectiveness estimate,E2_Debt/contract relief,Croatia,HRV,0.4099745,score,2019.0
53,Governance,Rule of law estimate ,E2_Debt/contract relief,Croatia,HRV,0.3661346,score,2019.0
54,Environment,CO2 emissions (metric tons per capita),E2_Debt/contract relief,Croatia,HRV,4.189377,metric tons per capita,2016.0
55,Health,Prevalence of total cancers,E2_Debt/contract relief,Croatia,HRV,0.032925,percent,2019.0
56,Health,Prevalence of down syndrome,E2_Debt/contract relief,Croatia,HRV,0.000132,percent,2019.0
57,Environment,Electric power consumption ,E2_Debt/contract relief,Croatia,HRV,3714.382988442071,kWh per capita,2014.0
59,Governance,Total freedom in the world score ,E2_Debt/contract relief,Croatia,HRV,85.0,score,2021.0
61,Economics,"Unemployment, total (% of total labor force) (modeled ILO estimate)",E2_Debt/contract relief,Croatia,HRV,7.11399984,percent of total labor force,2020.0
63,Social issues ,Proportion of seats held by women in national parliaments (%),E2_Debt/contract relief,Croatia,HRV,29.8013245,proportion,2020.0
65,Health,"Immunization, DPT (% of children ages 12-23 months)",E2_Debt/contract relief,Croatia,HRV,94.0,percent,2019.0
66,Demographics,Fixed telephone subscriptions,E2_Debt/contract relief,Croatia,HRV,1333660.0,number,2019.0
68,Environment,Electricity production from coal sources ,E2_Debt/contract relief,Croatia,HRV,20.5552589428724,percent of total,2015.0
69,Environment,"Electricity production from oil, gas and coal sources",E2_Debt/contract relief,Croatia,HRV,33.17316248442783,percent of total,2015.0
71,Economics,Volume of imports,E2_Debt/contract relief,Croatia,HRV,6.2,percent change,2020.0
74,Governance,Regulatory quality estimate,E2_Debt/contract relief,Croatia,HRV,0.5910058,score,2019.0
80,Governance,Fragile States Index Total ,E2_Debt/contract relief,Croatia,HRV,46.094521183346394,score,2020.0
82,Economics,"Labor force participation rate, total (% of total population ages 15+) (modeled ILO estimate)",E2_Debt/contract relief,Croatia,HRV,50.9690018,Percentage of total population,2020.0
85,Environment,Energy use ,E2_Debt/contract relief,Croatia,HRV,80.1778813876197,"(kg of oil equivalent) per $1,000 GDP (constant 2017 PPP)",2014.0
86,Governance,Human Freedom Score ,E2_Debt/contract relief,Croatia,HRV,7.92,score,2018.0
89,Governance,Serious assault (rate),E2_Debt/contract relief,Croatia,HRV,17.64,rate,2018.0
98,Health,Prevalence of obesity,E2_Debt/contract relief,Croatia,HRV,24.4,percent,2016.0
106,Health,"Nurses and midwives (per 1,000 people)",E2_Debt/contract relief,Croatia,HRV,8.1224,Ones,2016.0
115,Environment,Electricity production from nuclear sources ,E2_Debt/contract relief,Croatia,HRV,0.0,percent of total,2014.0
117,Environment,Access to electricity ,E2_Debt/contract relief,Croatia,HRV,100.0,percent of population,2018.0
