rank,Category,Indicator,Policy,Country,ISO,value,unit,year
1,Demographics,Individuals using the Internet,E2_Debt/contract relief,East Timor,TLS,27.4927,percent of population,2019.0
2,Governance,Corruption Perceptions Index,E2_Debt/contract relief,East Timor,TLS,40.0,score,2020.0
3,Health,Prevalence of COVID-19,E2_Debt/contract relief,East Timor,TLS,31.0,"Number (cumulative total by Dec 26,2020)",2020.0
6,Demographics,Secure Internet servers ,E2_Debt/contract relief,East Timor,TLS,37.89287760832529,per 1 million people,2019.0
8,Health,"Incidence of tuberculosis (per 100,000 people)",E2_Debt/contract relief,East Timor,TLS,498.0,Cases,2019.0
9,Health,Summary exposure value tobacco,E2_Debt/contract relief,East Timor,TLS,30.01449,Rate (risk-weighted prevalence),2019.0
10,Demographics,Fixed broadband subscriptions,E2_Debt/contract relief,East Timor,TLS,0.0463994,per 100 people,2019.0
11,Health,"Immunization, measles (% of children ages 12-23 months)",E2_Debt/contract relief,East Timor,TLS,85.0,percent,2019.0
12,Environment,"PM2.5 air pollution, population exposed to levels exceeding WHO guideline value ",E2_Debt/contract relief,East Timor,TLS,100.0,percent of total,2017.0
13,Health,Mortality due to COVID-19,E2_Debt/contract relief,East Timor,TLS,0.0,"Number (cumulative total by Dec 26,2020)",2020.0
14,Health,Domestic General Government Health Expenditure (GGHE-D) as % General Government Expenditure (GGE),E2_Debt/contract relief,East Timor,TLS,2.6,percent,2018.0
15,Social issues ,Press freedom score,E2_Debt/contract relief,East Timor,TLS,29.9,score,2020.0
16,Economics,Employment in services (% of total employment) (modeled ILO estimate),E2_Debt/contract relief,East Timor,TLS,46.4160004,Percentage of total employment,2020.0
17,Environment,CO2 emissions (kt),E2_Debt/contract relief,East Timor,TLS,495.045,kt,2016.0
18,Governance,Control of corruption estimate,E2_Debt/contract relief,East Timor,TLS,-0.3829827,score,2019.0
19,Health,Prevalence of Respiratory infections and tuberculosis,E2_Debt/contract relief,East Timor,TLS,0.383368,percent,2019.0
20,Social issues ,Net migration,E2_Debt/contract relief,East Timor,TLS,-26924.0,net total / data are 5 year estimates,2019.0
21,Health,Prevalence of anxiety disorders,E2_Debt/contract relief,East Timor,TLS,0.035978,percent,2019.0
22,Governance,Economic Freedom Score,E2_Debt/contract relief,East Timor,TLS,6.29,score,2018.0
23,Health,Prevalence of Diabetes,E2_Debt/contract relief,East Timor,TLS,0.033862,percent,2019.0
24,Governance,Aggregate score for the Political Rights category,E2_Debt/contract relief,East Timor,TLS,33.0,score,2021.0
26,Health,Prevalence of Hypertensive heart disease,E2_Debt/contract relief,East Timor,TLS,0.001852,percent,2019.0
28,Economics,"Labor force participation rate, female (% of female population ages 15+) (modeled ILO estimate)",E2_Debt/contract relief,East Timor,TLS,61.9220009,Percentage of females of the total population,2020.0
29,Environment,"Adjusted net savings, including particulate emission damage",E2_Debt/contract relief,East Timor,TLS,-11.5159455681386,percent of GNI,2018.0
30,Health,"Physicians (per 1,000 people)",E2_Debt/contract relief,East Timor,TLS,0.7224,Ones,2018.0
31,Governance,Personal Freedom Score ,E2_Debt/contract relief,East Timor,TLS,7.48,score,2018.0
32,Governance,Human Development Index,E2_Debt/contract relief,East Timor,TLS,0.606,index,2019.0
33,Environment,Renewable energy consumption ,E2_Debt/contract relief,East Timor,TLS,18.2236892844473,percent of total final energy consumption,2015.0
34,Demographics,Age dependency ratio (% of working-age population),E2_Debt/contract relief,East Timor,TLS,71.17020403516807,proportion,2019.0
35,Health,"Prevalence of overweight (modeled estimate, % of children under 5)",E2_Debt/contract relief,East Timor,TLS,2.6,percent,2020.0
36,Governance,Political stability and absence of violence/terrorism estimate,E2_Debt/contract relief,East Timor,TLS,0.2398703,score,2019.0
37,Health,"Prevalence of HIV, total (% of population ages 15-49)",E2_Debt/contract relief,East Timor,TLS,0.2,percent,2019.0
38,Governance,Voice and accountability estimate,E2_Debt/contract relief,East Timor,TLS,0.3827664,score,2019.0
39,Social issues ,"Intentional homicides (per 100,000 people)",E2_Debt/contract relief,East Timor,TLS,4.0959830945,"proportion, pero 100,000 people",2015.0
42,Social issues ,Proportion of women in managerial positions (%),E2_Debt/contract relief,East Timor,TLS,24.51,percent,2016.0
43,Environment,"PM2.5 air pollution, mean annual exposure",E2_Debt/contract relief,East Timor,TLS,19.25721,micrograms per cubic meter,2017.0
45,Health,Prevalence of chronic kidney disease,E2_Debt/contract relief,East Timor,TLS,0.073541,percent,2019.0
46,Governance,Aggregate score for the Civil Liberties category,E2_Debt/contract relief,East Timor,TLS,39.0,score,2021.0
48,Social issues ,Gini index (World Bank estimate),E2_Debt/contract relief,East Timor,TLS,28.7,index ,2014.0
50,Health,Prevalence of Depressive disorders,E2_Debt/contract relief,East Timor,TLS,0.024059,percent,2019.0
51,Demographics,Mobile cellular subscriptions,E2_Debt/contract relief,East Timor,TLS,110.218,per 100 people,2019.0
52,Governance,Government effectiveness estimate,E2_Debt/contract relief,East Timor,TLS,-0.8846924,score,2019.0
53,Governance,Rule of law estimate ,E2_Debt/contract relief,East Timor,TLS,-1.111015,score,2019.0
54,Environment,CO2 emissions (metric tons per capita),E2_Debt/contract relief,East Timor,TLS,0.406012,metric tons per capita,2016.0
55,Health,Prevalence of total cancers,E2_Debt/contract relief,East Timor,TLS,0.002777,percent,2019.0
56,Health,Prevalence of down syndrome,E2_Debt/contract relief,East Timor,TLS,0.000254,percent,2019.0
59,Governance,Total freedom in the world score ,E2_Debt/contract relief,East Timor,TLS,72.0,score,2021.0
61,Economics,"Unemployment, total (% of total labor force) (modeled ILO estimate)",E2_Debt/contract relief,East Timor,TLS,4.60300016,percent of total labor force,2020.0
63,Social issues ,Proportion of seats held by women in national parliaments (%),E2_Debt/contract relief,East Timor,TLS,38.46153846,proportion,2020.0
65,Health,"Immunization, DPT (% of children ages 12-23 months)",E2_Debt/contract relief,East Timor,TLS,83.0,percent,2019.0
66,Demographics,Fixed telephone subscriptions,E2_Debt/contract relief,East Timor,TLS,2075.0,number,2019.0
67,Social issues ,Progression to secondary school (%),E2_Debt/contract relief,East Timor,TLS,93.20697,proportion,2017.0
70,Demographics,Urban population (% of total population),E2_Debt/contract relief,East Timor,TLS,30.947,total,2019.0
73,Health,"Prevalence of stunting, height for age (modeled estimate, % of children under 5)",E2_Debt/contract relief,East Timor,TLS,48.8,percent,2020.0
74,Governance,Regulatory quality estimate,E2_Debt/contract relief,East Timor,TLS,-0.784347,score,2019.0
76,Demographics,People using at least basic sanitation services (% of population),E2_Debt/contract relief,East Timor,TLS,53.5190078259669,proportion,2017.0
77,Demographics,Rural population (% of total population),E2_Debt/contract relief,East Timor,TLS,69.053,proportion,2019.0
79,Demographics,People with basic handwashing facilities including soap and water (% of population),E2_Debt/contract relief,East Timor,TLS,28.1782288377724,proportion,2017.0
80,Governance,Fragile States Index Total ,E2_Debt/contract relief,East Timor,TLS,82.66311377505994,score,2020.0
81,Economics,"International tourism, receipts",E2_Debt/contract relief,East Timor,TLS,70000000.0,US Dollar,2019.0
82,Economics,"Labor force participation rate, total (% of total population ages 15+) (modeled ILO estimate)",E2_Debt/contract relief,East Timor,TLS,67.3339996,Percentage of total population,2020.0
83,Governance,"CPIA transparency, accountability, and corruption in the public sector rating (1=low to 6=high)",E2_Debt/contract relief,East Timor,TLS,3.0,rating,2019.0
84,Social issues ,"Primary completion rate, total (% of relevant age group)",E2_Debt/contract relief,East Timor,TLS,105.198341369629,proportion,2019.0
86,Governance,Human Freedom Score ,E2_Debt/contract relief,East Timor,TLS,6.89,score,2018.0
87,Social issues ,"Literacy rate, adult total (% of people ages 15 and above)",E2_Debt/contract relief,East Timor,TLS,68.0668334960938,proportion,2018.0
88,Demographics,"Age dependency ratio, old (% of working-age population)",E2_Debt/contract relief,East Timor,TLS,7.337270900566279,proportion,2019.0
92,Economics,"Trade, total as % of GDP",E2_Debt/contract relief,East Timor,TLS,38.98658,percent,2018.0
94,Social issues ,Women who believe a husband is justified in beating his wife (any of five reasons) (%),E2_Debt/contract relief,East Timor,TLS,74.0,proportion,2016.0
96,Economics,Starting a Business (Score),E2_Debt/contract relief,East Timor,TLS,89.4,Score,2019.0
97,Demographics,Internet users (per 100 people),E2_Debt/contract relief,East Timor,TLS,27.49273,per 100 population,2017.0
98,Health,Prevalence of obesity,E2_Debt/contract relief,East Timor,TLS,3.8,percent,2016.0
100,Economics,"Foreign direct investment, net",E2_Debt/contract relief,East Timor,TLS,74580320.0,US Dollar,2019.0
101,Economics,"Lending interest rates, percent per annum",E2_Debt/contract relief,East Timor,TLS,15.36218,percent per annum,2019.0
102,Demographics,Mobile cellular (per 100 people),E2_Debt/contract relief,East Timor,TLS,115.8143,per 100 population,2018.0
106,Health,"Nurses and midwives (per 1,000 people)",E2_Debt/contract relief,East Timor,TLS,1.668,Ones,2018.0
107,Economics,"Output per worker (GDP constant 2011 international $ in PPP -- ILO modelled estimates, Nov. 2019",E2_Debt/contract relief,East Timor,TLS,17691.4,international $ in PPP,2020.0
108,Demographics,Fixed telephone (per 100 people),E2_Debt/contract relief,East Timor,TLS,0.17398,per 100 population,2018.0
109,Social issues ,Proportion of population spending more than 10% of household consumption or income on out-of-pocket health care expenditure (%),E2_Debt/contract relief,East Timor,TLS,2.92760682106018,proportion,2014.0
110,Demographics,"Population, total",E2_Debt/contract relief,East Timor,TLS,1293119.0,total,2019.0
111,Economics,Expenditure on social protection (% of GDP),E2_Debt/contract relief,East Timor,TLS,8.62674,percent,2018.0
112,Economics,Expenditure on health (% of GDP),E2_Debt/contract relief,East Timor,TLS,3.36514,percent,2018.0
113,Economics,Expenditure on education (% of GDP),E2_Debt/contract relief,East Timor,TLS,4.72845,percent,2018.0
116,Social issues ,Proportion of people living below 50 percent of median income (%),E2_Debt/contract relief,East Timor,TLS,5.4,proportion,2014.0
117,Environment,Access to electricity ,E2_Debt/contract relief,East Timor,TLS,85.5918350219727,percent of population,2018.0
