rank,Category,Indicator,Policy,Country,ISO,value,unit,year
1,Demographics,Individuals using the Internet,H7_Vaccination policy,Barbados,BRB,81.7608,percent of population,2019.0
2,Governance,Corruption Perceptions Index,H7_Vaccination policy,Barbados,BRB,64.0,score,2020.0
3,Health,Prevalence of COVID-19,H7_Vaccination policy,Barbados,BRB,305.0,"Number (cumulative total by Dec 26,2020)",2020.0
5,Demographics,Secure Internet servers ,H7_Vaccination policy,Barbados,BRB,940.6846093545857,per 1 million people,2019.0
6,Governance,Serious assault (rate),H7_Vaccination policy,Barbados,BRB,502.05,rate,2017.0
8,Environment,CO2 emissions (kt),H7_Vaccination policy,Barbados,BRB,1276.116,kt,2016.0
9,Demographics,Fixed telephone subscriptions,H7_Vaccination policy,Barbados,BRB,138312.0,number,2019.0
11,Economics,Employment in services (% of total employment) (modeled ILO estimate),H7_Vaccination policy,Barbados,BRB,78.5100021,Percentage of total employment,2020.0
12,Demographics,Fixed broadband subscriptions,H7_Vaccination policy,Barbados,BRB,37.2103,per 100 people,2019.0
13,Economics,Volume of imports,H7_Vaccination policy,Barbados,BRB,2.294,percent change,2020.0
14,Health,Prevalence of Respiratory infections and tuberculosis,H7_Vaccination policy,Barbados,BRB,0.245301,percent,2019.0
15,Governance,Political stability and absence of violence/terrorism estimate,H7_Vaccination policy,Barbados,BRB,0.9417337,score,2019.0
16,Environment,Renewable energy consumption ,H7_Vaccination policy,Barbados,BRB,2.78635820637435,percent of total final energy consumption,2015.0
17,Health,"Incidence of tuberculosis (per 100,000 people)",H7_Vaccination policy,Barbados,BRB,0.0,Cases,2019.0
18,Health,Domestic General Government Health Expenditure (GGHE-D) as % General Government Expenditure (GGE),H7_Vaccination policy,Barbados,BRB,2.9,percent,2018.0
19,Health,"Physicians (per 1,000 people)",H7_Vaccination policy,Barbados,BRB,2.4843,Ones,2017.0
20,Health,Summary exposure value tobacco,H7_Vaccination policy,Barbados,BRB,10.06039,Rate (risk-weighted prevalence),2019.0
21,Health,Prevalence of anxiety disorders,H7_Vaccination policy,Barbados,BRB,0.049347,percent,2019.0
22,Governance,Rule of law estimate ,H7_Vaccination policy,Barbados,BRB,0.3570292,score,2019.0
24,Economics,"Unemployment, total (% of total labor force) (modeled ILO estimate)",H7_Vaccination policy,Barbados,BRB,10.9379997,percent of total labor force,2020.0
26,Social issues ,Net migration,H7_Vaccination policy,Barbados,BRB,-397.0,net total / data are 5 year estimates,2019.0
27,Economics,"Labor force participation rate, total (% of total population ages 15+) (modeled ILO estimate)",H7_Vaccination policy,Barbados,BRB,64.901001,Percentage of total population,2020.0
28,Health,Prevalence of total cancers,H7_Vaccination policy,Barbados,BRB,0.028345,percent,2019.0
29,Governance,Total freedom in the world score ,H7_Vaccination policy,Barbados,BRB,95.0,score,2021.0
30,Governance,Aggregate score for the Civil Liberties category,H7_Vaccination policy,Barbados,BRB,57.0,score,2021.0
31,Health,Prevalence of obesity,H7_Vaccination policy,Barbados,BRB,23.1,percent,2016.0
33,Governance,Personal Freedom Score ,H7_Vaccination policy,Barbados,BRB,7.76,score,2018.0
34,Health,Mortality due to COVID-19,H7_Vaccination policy,Barbados,BRB,7.0,"Number (cumulative total by Dec 26,2020)",2020.0
35,Environment,"PM2.5 air pollution, mean annual exposure",H7_Vaccination policy,Barbados,BRB,23.08018,micrograms per cubic meter,2017.0
36,Demographics,Mobile cellular subscriptions,H7_Vaccination policy,Barbados,BRB,108.609,per 100 people,2019.0
37,Social issues ,Proportion of seats held by women in national parliaments (%),H7_Vaccination policy,Barbados,BRB,20.0,proportion,2020.0
38,Governance,Fragile States Index Total ,H7_Vaccination policy,Barbados,BRB,46.40725753500914,score,2020.0
39,Governance,Economic Freedom Score,H7_Vaccination policy,Barbados,BRB,6.22,score,2018.0
40,Health,"Prevalence of stunting, height for age (modeled estimate, % of children under 5)",H7_Vaccination policy,Barbados,BRB,6.6,percent,2020.0
42,Health,"Prevalence of HIV, total (% of population ages 15-49)",H7_Vaccination policy,Barbados,BRB,0.8,percent,2019.0
45,Health,Prevalence of chronic kidney disease,H7_Vaccination policy,Barbados,BRB,0.132863,percent,2019.0
47,Environment,"Adjusted net savings, including particulate emission damage",H7_Vaccination policy,Barbados,BRB,-0.626937448351921,percent of GNI,2016.0
48,Environment,CO2 emissions (metric tons per capita),H7_Vaccination policy,Barbados,BRB,4.465129,metric tons per capita,2016.0
49,Economics,Volume of exports,H7_Vaccination policy,Barbados,BRB,2.911,percent change,2020.0
50,Social issues ,Proportion of women in managerial positions (%),H7_Vaccination policy,Barbados,BRB,48.6,percent,2016.0
51,Health,Prevalence of down syndrome,H7_Vaccination policy,Barbados,BRB,0.000224,percent,2019.0
52,Health,"Prevalence of overweight (modeled estimate, % of children under 5)",H7_Vaccination policy,Barbados,BRB,11.4,percent,2020.0
54,Demographics,Urban population (% of total population),H7_Vaccination policy,Barbados,BRB,31.158,total,2019.0
55,Governance,Aggregate score for the Political Rights category,H7_Vaccination policy,Barbados,BRB,38.0,score,2021.0
56,Governance,Control of corruption estimate,H7_Vaccination policy,Barbados,BRB,1.261709,score,2019.0
57,Social issues ,Proportion of population pushed below the $1.90 ($ 2011 PPP) poverty line by out-of-pocket health care expenditure (%),H7_Vaccination policy,Barbados,BRB,0.336767345666885,proportion,2016.0
59,Demographics,People with basic handwashing facilities including soap and water (% of population),H7_Vaccination policy,Barbados,BRB,88.4693506083686,proportion,2016.0
60,Social issues ,"Primary completion rate, total (% of relevant age group)",H7_Vaccination policy,Barbados,BRB,90.0936737060547,proportion,2019.0
64,Demographics,People using at least basic sanitation services (% of population),H7_Vaccination policy,Barbados,BRB,97.2793784985907,proportion,2017.0
65,Health,Prevalence of Depressive disorders,H7_Vaccination policy,Barbados,BRB,0.039605,percent,2019.0
66,Environment,"PM2.5 air pollution, population exposed to levels exceeding WHO guideline value ",H7_Vaccination policy,Barbados,BRB,100.0,percent of total,2017.0
67,Health,"Immunization, DPT (% of children ages 12-23 months)",H7_Vaccination policy,Barbados,BRB,90.0,percent,2019.0
68,Demographics,Rural population (% of total population),H7_Vaccination policy,Barbados,BRB,68.842,proportion,2019.0
69,Health,Prevalence of Hypertensive heart disease,H7_Vaccination policy,Barbados,BRB,0.003869,percent,2019.0
70,Health,Prevalence of Diabetes,H7_Vaccination policy,Barbados,BRB,0.123307,percent,2019.0
72,Health,"Nurses and midwives (per 1,000 people)",H7_Vaccination policy,Barbados,BRB,3.06,Ones,2018.0
73,Governance,Human Development Index,H7_Vaccination policy,Barbados,BRB,0.814,index,2019.0
75,Economics,"Central government debt, total",H7_Vaccination policy,Barbados,BRB,141.7288148568399,percent of GDP,2015.0
77,Demographics,"Age dependency ratio, old (% of working-age population)",H7_Vaccination policy,Barbados,BRB,24.32754218037692,proportion,2019.0
80,Social issues ,"Intentional homicides (per 100,000 people)",H7_Vaccination policy,Barbados,BRB,9.7683505442,"proportion, pero 100,000 people",2018.0
81,Economics,"Labor force participation rate, female (% of female population ages 15+) (modeled ILO estimate)",H7_Vaccination policy,Barbados,BRB,61.4000015,Percentage of females of the total population,2020.0
82,Governance,Voice and accountability estimate,H7_Vaccination policy,Barbados,BRB,1.131867,score,2019.0
84,Governance,Government effectiveness estimate,H7_Vaccination policy,Barbados,BRB,0.631425,score,2019.0
87,Health,"Immunization, measles (% of children ages 12-23 months)",H7_Vaccination policy,Barbados,BRB,92.0,percent,2019.0
88,Environment,Access to electricity ,H7_Vaccination policy,Barbados,BRB,100.0,percent of population,2018.0
90,Governance,Human Freedom Score ,H7_Vaccination policy,Barbados,BRB,6.99,score,2018.0
97,Governance,Regulatory quality estimate,H7_Vaccination policy,Barbados,BRB,0.412301,score,2019.0
100,Demographics,"Population, total",H7_Vaccination policy,Barbados,BRB,287025.0,total,2019.0
101,Demographics,Age dependency ratio (% of working-age population),H7_Vaccination policy,Barbados,BRB,49.88328920777654,proportion,2019.0
111,Social issues ,"Literacy rate, adult total (% of people ages 15 and above)",H7_Vaccination policy,Barbados,BRB,99.5999984741211,proportion,2014.0
115,Social issues ,Proportion of population spending more than 10% of household consumption or income on out-of-pocket health care expenditure (%),H7_Vaccination policy,Barbados,BRB,16.3744926452637,proportion,2016.0
