rank,Category,Indicator,Policy,Country,ISO,value,unit,year
1,Demographics,Individuals using the Internet,H7_Vaccination policy,China,CHN,54.3,percent of population,2019.0
2,Governance,Corruption Perceptions Index,H7_Vaccination policy,China,CHN,42.0,score,2020.0
3,Health,Prevalence of COVID-19,H7_Vaccination policy,China,CHN,95580.0,"Number (cumulative total by Dec 26,2020)",2020.0
4,Economics,"Foreign direct investment, net",H7_Vaccination policy,China,CHN,155815344600.0,US Dollar,2019.0
5,Demographics,Secure Internet servers ,H7_Vaccination policy,China,CHN,734.9752989701047,per 1 million people,2019.0
7,Social issues ,Press freedom score,H7_Vaccination policy,China,CHN,78.48,score,2020.0
8,Environment,CO2 emissions (kt),H7_Vaccination policy,China,CHN,9893038.0,kt,2016.0
9,Demographics,Fixed telephone subscriptions,H7_Vaccination policy,China,CHN,191033000.0,number,2019.0
10,Environment,Electric power consumption ,H7_Vaccination policy,China,CHN,3927.044499989005,kWh per capita,2014.0
11,Economics,Employment in services (% of total employment) (modeled ILO estimate),H7_Vaccination policy,China,CHN,47.0880013,Percentage of total employment,2020.0
12,Demographics,Fixed broadband subscriptions,H7_Vaccination policy,China,CHN,31.3352,per 100 people,2019.0
13,Economics,Volume of imports,H7_Vaccination policy,China,CHN,4.83,percent change,2020.0
14,Health,Prevalence of Respiratory infections and tuberculosis,H7_Vaccination policy,China,CHN,0.344937,percent,2019.0
15,Governance,Political stability and absence of violence/terrorism estimate,H7_Vaccination policy,China,CHN,-0.2403826,score,2019.0
16,Environment,Renewable energy consumption ,H7_Vaccination policy,China,CHN,12.4133525698911,percent of total final energy consumption,2015.0
17,Health,"Incidence of tuberculosis (per 100,000 people)",H7_Vaccination policy,China,CHN,58.0,Cases,2019.0
18,Health,Domestic General Government Health Expenditure (GGHE-D) as % General Government Expenditure (GGE),H7_Vaccination policy,China,CHN,3.0,percent,2018.0
19,Health,"Physicians (per 1,000 people)",H7_Vaccination policy,China,CHN,1.9798,Ones,2017.0
20,Health,Summary exposure value tobacco,H7_Vaccination policy,China,CHN,30.52735,Rate (risk-weighted prevalence),2019.0
21,Health,Prevalence of anxiety disorders,H7_Vaccination policy,China,CHN,0.035105,percent,2019.0
22,Governance,Rule of law estimate ,H7_Vaccination policy,China,CHN,-0.2747186,score,2019.0
23,Environment,Electricity production from oil sources,H7_Vaccination policy,China,CHN,0.165618383349663,percent of total,2015.0
24,Economics,"Unemployment, total (% of total labor force) (modeled ILO estimate)",H7_Vaccination policy,China,CHN,4.36999989,percent of total labor force,2020.0
25,Environment,Fossil fuel energy consumption,H7_Vaccination policy,China,CHN,87.67043,percent of total,2014.0
26,Social issues ,Net migration,H7_Vaccination policy,China,CHN,-1741996.0,net total / data are 5 year estimates,2019.0
27,Economics,"Labor force participation rate, total (% of total population ages 15+) (modeled ILO estimate)",H7_Vaccination policy,China,CHN,67.4649963,Percentage of total population,2020.0
28,Health,Prevalence of total cancers,H7_Vaccination policy,China,CHN,0.01378,percent,2019.0
29,Governance,Total freedom in the world score ,H7_Vaccination policy,China,CHN,9.0,score,2021.0
30,Governance,Aggregate score for the Civil Liberties category,H7_Vaccination policy,China,CHN,11.0,score,2021.0
31,Health,Prevalence of obesity,H7_Vaccination policy,China,CHN,6.2,percent,2016.0
32,Environment,Combustible renewables and waste,H7_Vaccination policy,China,CHN,2.883354,percent of total energy,2014.0
33,Governance,Personal Freedom Score ,H7_Vaccination policy,China,CHN,5.92,score,2018.0
34,Health,Mortality due to COVID-19,H7_Vaccination policy,China,CHN,4770.0,"Number (cumulative total by Dec 26,2020)",2020.0
35,Environment,"PM2.5 air pollution, mean annual exposure",H7_Vaccination policy,China,CHN,52.6646,micrograms per cubic meter,2017.0
36,Demographics,Mobile cellular subscriptions,H7_Vaccination policy,China,CHN,120.36,per 100 people,2019.0
37,Social issues ,Proportion of seats held by women in national parliaments (%),H7_Vaccination policy,China,CHN,24.94117647,proportion,2020.0
38,Governance,Fragile States Index Total ,H7_Vaccination policy,China,CHN,69.85878789983346,score,2020.0
39,Governance,Economic Freedom Score,H7_Vaccination policy,China,CHN,6.21,score,2018.0
40,Health,"Prevalence of stunting, height for age (modeled estimate, % of children under 5)",H7_Vaccination policy,China,CHN,4.7,percent,2020.0
41,Environment,"Energy imports, net ",H7_Vaccination policy,China,CHN,15.02180074011391,percent of energy use,2014.0
43,Economics,"Output per worker (GDP constant 2011 international $ in PPP -- ILO modelled estimates, Nov. 2019",H7_Vaccination policy,China,CHN,33981.5,international $ in PPP,2020.0
45,Health,Prevalence of chronic kidney disease,H7_Vaccination policy,China,CHN,0.110432,percent,2019.0
46,Social issues ,Gini index (World Bank estimate),H7_Vaccination policy,China,CHN,38.5,index ,2016.0
47,Environment,"Adjusted net savings, including particulate emission damage",H7_Vaccination policy,China,CHN,21.1328111797371,percent of GNI,2018.0
48,Environment,CO2 emissions (metric tons per capita),H7_Vaccination policy,China,CHN,7.17581,metric tons per capita,2016.0
49,Economics,Volume of exports,H7_Vaccination policy,China,CHN,4.1,percent change,2020.0
51,Health,Prevalence of down syndrome,H7_Vaccination policy,China,CHN,0.000107,percent,2019.0
52,Health,"Prevalence of overweight (modeled estimate, % of children under 5)",H7_Vaccination policy,China,CHN,8.3,percent,2020.0
53,Social issues ,Life Ladder ,H7_Vaccination policy,China,CHN,5.339099884033203,score,2021.0
54,Demographics,Urban population (% of total population),H7_Vaccination policy,China,CHN,60.308,total,2019.0
55,Governance,Aggregate score for the Political Rights category,H7_Vaccination policy,China,CHN,-2.0,score,2021.0
56,Governance,Control of corruption estimate,H7_Vaccination policy,China,CHN,-0.3234968,score,2019.0
58,Environment,Electricity production from coal sources ,H7_Vaccination policy,China,CHN,70.3094269525225,percent of total,2015.0
61,Environment,Electricity production from nuclear sources ,H7_Vaccination policy,China,CHN,2.339286360399206,percent of total,2014.0
63,Environment,"Electricity production from oil, gas and coal sources",H7_Vaccination policy,China,CHN,72.96207597398976,percent of total,2015.0
64,Demographics,People using at least basic sanitation services (% of population),H7_Vaccination policy,China,CHN,84.7607877105451,proportion,2017.0
65,Health,Prevalence of Depressive disorders,H7_Vaccination policy,China,CHN,0.03673,percent,2019.0
66,Environment,"PM2.5 air pollution, population exposed to levels exceeding WHO guideline value ",H7_Vaccination policy,China,CHN,99.9982944622564,percent of total,2017.0
67,Health,"Immunization, DPT (% of children ages 12-23 months)",H7_Vaccination policy,China,CHN,99.0,percent,2019.0
68,Demographics,Rural population (% of total population),H7_Vaccination policy,China,CHN,39.692,proportion,2019.0
69,Health,Prevalence of Hypertensive heart disease,H7_Vaccination policy,China,CHN,0.005799,percent,2019.0
70,Health,Prevalence of Diabetes,H7_Vaccination policy,China,CHN,0.06749,percent,2019.0
72,Health,"Nurses and midwives (per 1,000 people)",H7_Vaccination policy,China,CHN,2.6621,Ones,2017.0
73,Governance,Human Development Index,H7_Vaccination policy,China,CHN,0.761,index,2019.0
74,Environment,Energy use (kg of oil equivalent per capita),H7_Vaccination policy,China,CHN,2236.729907569616,kg of oil equivalent per capita,2014.0
76,Demographics,Refugee population by country or territory of asylum,H7_Vaccination policy,China,CHN,303379.0,proportion,2019.0
77,Demographics,"Age dependency ratio, old (% of working-age population)",H7_Vaccination policy,China,CHN,16.22123581769625,proportion,2019.0
80,Social issues ,"Intentional homicides (per 100,000 people)",H7_Vaccination policy,China,CHN,0.52709078934,"proportion, pero 100,000 people",2018.0
81,Economics,"Labor force participation rate, female (% of female population ages 15+) (modeled ILO estimate)",H7_Vaccination policy,China,CHN,59.8419991,Percentage of females of the total population,2020.0
82,Governance,Voice and accountability estimate,H7_Vaccination policy,China,CHN,-1.612372,score,2019.0
84,Governance,Government effectiveness estimate,H7_Vaccination policy,China,CHN,0.5182531,score,2019.0
85,Economics,Expenditure on social protection (% of GDP),H7_Vaccination policy,China,CHN,2.98531,percent,2019.0
87,Health,"Immunization, measles (% of children ages 12-23 months)",H7_Vaccination policy,China,CHN,99.0,percent,2019.0
88,Environment,Access to electricity ,H7_Vaccination policy,China,CHN,100.0,percent of population,2018.0
89,Economics,Expenditure on education (% of GDP),H7_Vaccination policy,China,CHN,3.52349,percent,2019.0
90,Governance,Human Freedom Score ,H7_Vaccination policy,China,CHN,6.07,score,2018.0
91,Environment,Energy use ,H7_Vaccination policy,China,CHN,187.6870333357631,"(kg of oil equivalent) per $1,000 GDP (constant 2017 PPP)",2014.0
92,Economics,Expenditure on health (% of GDP),H7_Vaccination policy,China,CHN,1.69517,percent,2019.0
94,Environment,"Electricity production from renewable sources, excluding hydroelectric",H7_Vaccination policy,China,CHN,283851000000.0,kWh,2015.0
95,Health,Hospital beds (per 10 000 population),H7_Vaccination policy,China,CHN,43.1,Ones,2017.0
97,Governance,Regulatory quality estimate,H7_Vaccination policy,China,CHN,-0.2446144,score,2019.0
98,Economics,"Trade, total as % of GDP",H7_Vaccination policy,China,CHN,31.90509,percent,2019.0
100,Demographics,"Population, total",H7_Vaccination policy,China,CHN,1397715000.0,total,2019.0
101,Demographics,Age dependency ratio (% of working-age population),H7_Vaccination policy,China,CHN,41.39611978269686,proportion,2019.0
104,Economics,Growth rates of household expenditure or income per capita (%),H7_Vaccination policy,China,CHN,7.0,percent,2016.0
106,Economics,"Lending interest rates, percent per annum",H7_Vaccination policy,China,CHN,4.35,percent per annum,2019.0
107,Economics,"International tourism, receipts",H7_Vaccination policy,China,CHN,35832000000.0,US Dollar,2019.0
108,Economics,Stock market capitalization (US$ million),H7_Vaccination policy,China,CHN,8515504380000.001,US Dollar,2019.0
109,Health,COVID-19 vaccine administered,H7_Vaccination policy,China,CHN,1005510.0,"Number (cumulative total by Dec 26,2020)",2020.0
111,Social issues ,"Literacy rate, adult total (% of people ages 15 and above)",H7_Vaccination policy,China,CHN,96.8408889770508,proportion,2018.0
