rank,Category,Indicator,Policy,Country,ISO,value,unit,year
3,Health,Prevalence of COVID-19,C1_School closing,Martinique,MTQ,5601.0,"Number (cumulative total by Dec 26,2020)",2020.0
7,Health,Mortality due to COVID-19,C1_School closing,Martinique,MTQ,42.0,"Number (cumulative total by Dec 26,2020)",2020.0
22,Governance,Rule of law estimate ,C1_School closing,Martinique,MTQ,0.6005772,score,2019.0
23,Governance,Political stability and absence of violence/terrorism estimate,C1_School closing,Martinique,MTQ,0.7850212,score,2019.0
52,Governance,Regulatory quality estimate,C1_School closing,Martinique,MTQ,1.228176,score,2019.0
60,Governance,Government effectiveness estimate,C1_School closing,Martinique,MTQ,1.089055,score,2019.0
97,Governance,Control of corruption estimate,C1_School closing,Martinique,MTQ,1.234392,score,2019.0
